pid,provenance_html,related_html,related_ids,label,object_type,genre,tags,realdate,height_cm,width_cm,diameter_cm,plate_dimensions,support,drawing_medium,signature,signature_location,support_marks,further_inscription,collaborators,collaborator_notes,collectors_patrons,print_type,print_notes,printmaker,publisher,states,our_attribution,other_attribution_authorities,ertz_1979,ertz_2008,bailey_walker,hollstein_no,collection_type,location_country,location_city,location_collection,location_or_most_recent_sale_notes,provenance,bibliography,exhibition_history,related_works,copies_and_variants,curatorial_files,external_resources,order,layout,collection,thumbnail,full
9777,<table><tr><td></td><td>France Paris</td><td>Victor Decock</td></tr><tr><td>1925</td><td>France Paris</td><td>Frits Lugt (Lugt 1028)</td></tr></table>,<a href='/brughel/3235'><img src='/img/derivatives/simple/3235/thumbnail.jpg' /></a>|<a href='/brughel/9815'><img src='/img/derivatives/simple/9815/thumbnail.jpg' /></a>,3235|9815,Country Road with Four Windmills,Drawing,Landscape,,ca. 1618-ca. 1620,16,26.6,,,Paper,"Pen and bistre, lightly washed in blue",,,,,,,,,,,,,,Bailey/Walker cat. #PARI.LC.4,,,PARI.LC.4,,Public,France,Paris,Fondation Custodia (Collection Frits Lugt),5990,7047|7048,"London/Paris/Bern/Brussels 1972, p. 21, nr. 15, pl. 26; Paris 1974, nr. 13, pl. 70","London/Paris/Bern/Brussels 1972, nr. 15|Paris 1974, nr. 13",3235|9815,,,,048,brueghel_item,brueghel,img/derivatives/simple/9777/thumbnail.jpg,img/derivatives/simple/9777/full.jpg
3716,<table><tr><td>Spring 1963</td><td>England London</td><td>Gallery Leonard Koetser inv. #9</td></tr><tr><td>Apr 30 2010</td><td>England London</td><td>Sale Christie's Lot #22</td></tr></table>,<a href='/brughel/3575'><img src='/img/derivatives/simple/3575/thumbnail.jpg' /></a>,3575,Village Landscape with Cows,Painting,"Village, Town and Cityscape",Cattle House Village Stream,ca. 1609,11.2,16.8,,,,,BRVEGHEL,,Mark of Peeter Stas,,,,,,,,,,Produced in Jan Brueghel's Studio,"Ertz 2008-10, Add. 13",,,,,Private,,,,"New York, Joseph Guttmann, 2010",6348|6349,"Ertz 2008-10, #Add. 13; Como/Tel Aviv 2012, #10, p.207","Como/Tel Aviv 2012, #10|Bologna 2015, cat. #II.12",3575,,,,500,brueghel_item,brueghel,img/derivatives/simple/3716/thumbnail.jpg,img/derivatives/simple/3716/full.jpg
3702,<table><tr><td>18th century to 19th century</td><td>Netherlands Utrecht</td><td>F.J.O. Boijmans</td></tr><tr><td>1847</td><td>Netherlands Rotterdam</td><td>Bequeathed to the City of Rotterdam</td></tr><tr><td>1849</td><td>Netherlands Rotterdam</td><td>On permanent loan to Museum Boijmans Van Beuningen</td></tr></table>,<a href='/brughel/3619'><img src='/img/derivatives/simple/3619/thumbnail.jpg' /></a>|<a href='/brughel/3341'><img src='/img/derivatives/simple/3341/thumbnail.jpg' /></a>|<a href='/brughel/3033'><img src='/img/derivatives/simple/3033/thumbnail.jpg' /></a>,3619|3341|3033,View of the Castel dell&apos;Ovo,Drawing,"Village, Town and Cityscape",Bridge Castle Windmill River,,13,17.5,,,Paper,"Pen and brown ink, brown and blue wash, framing lines (partially cut off) with the pen in brown ink",,,Collector's mark: Museum Boymans (L.1857),"Verso, UC: ""III""; Verso, ""309"" and ""Roma 1593""; Verso, left: ""Heemskerk""",,,,,,,,,Jan Brueghel the Elder,Bailey/Walker cat. #ROTT.MB.2,,,ROTT.MB.2,,Public,Netherlands,Rotterdam,Museum Boijmans Van Beuningen,MB 307 (PK),7149|7150|7151,"Rotterdam 1852, nr. 379; Rotterdam 1869, nr. 253; Rotterdam 1901, nr. 309 (fl. 15); Gelder 1933, p. 20 (as Jan Brueghel); Winner 1972, p. 126, 144, fig. 4; Berlin 1975, p. 93, nr. 109, pl. 212; Bedoni 1983, p. 20-21; Giltaij 1988, nr. 50; Gaskell 1989, p. 472-473; Essen/Vienna 1997-98, p. 430, nr. 148; Ruby 1999, p. 44; Munich 2013, p. 36, nr. 43","Berlin 1975, nr. 109|Essen/Vienna 1997-98, under nr. 148|Munich 2013, nr. 43",3619|3341|3033,,,http://collectie.boijmans.nl/en/collection/mb-307-(pk),494,brueghel_item,brueghel,img/derivatives/simple/3702/thumbnail.jpg,img/derivatives/simple/3702/full.jpg
10198,<table><tr><td></td><td>Denmark Copenhagen</td><td>Collection at the Rosenborg Castle</td></tr></table>,<a href='/brughel/10197'><img src='/img/derivatives/simple/10197/thumbnail.jpg' /></a>|<a href='/brughel/10203'><img src='/img/derivatives/simple/10203/thumbnail.jpg' /></a>,10197|10203,Travelers in the Mountains,Painting,Staffage in Landscape,Series Dog Horse Momper Mountain Landscape,1605-1610,42.5,66.5,,,Panel,,,,,,Joos de Momper (1564-1635),,,,,,,,Jan Brueghel the Elder,,,640,,,Public,Denmark,Copenhagen,Rosenborg Castle,,9765,"Ertz 1986, Kat. 551, Abb. 379",,10197|10203,,,,083,brueghel_item,brueghel,img/derivatives/simple/10198/thumbnail.jpg,img/derivatives/simple/10198/full.jpg
3662,<table><tr><td></td><td></td><td>(Possibly) M. Coupry-Dupre</td></tr><tr><td>18th century to 19th century</td><td>France Paris</td><td>(Possibly) Jean-Baptiste Pierre Le Brun</td></tr><tr><td>1833</td><td>Belgium Brussels</td><td>(Possibly) Prince Auguste of Arenberg</td></tr><tr><td></td><td></td><td>Duke of Arenberg</td></tr><tr><td>Until 1956</td><td>England London</td><td>Speelman Ltd.</td></tr><tr><td>1956</td><td></td><td>Acquired by Lord Harold Samuel</td></tr></table>,<a href='/brughel/3835'><img src='/img/derivatives/simple/3835/thumbnail.jpg' /></a>|<a href='/brughel/3836'><img src='/img/derivatives/simple/3836/thumbnail.jpg' /></a>|<a href='/brughel/3331'><img src='/img/derivatives/simple/3331/thumbnail.jpg' /></a>,3835|3836|3331,Travelers Pausing before an Inn,Painting,"Village, Town and Cityscape",Traveling Cattle Dog Horse Inn Burghers Road Wagon,1616,22.2,39.8,,,Copper,,BRUEGHEL 1616,,,,,,,,,,,,Jan Brueghel the Elder,"Ertz 2008-10, #60, Ertz 1979, #307, Honig database",307,60,,,Public,England,London,"Guildhall Art Gallery, Collection of the City of London",,6232|6233|6234|6235|6236|6237,"Michel 1892, p. 83; Ertz 1979, cat. #307, fig. 263; Ertz 2008-10, cat. #60","Jackson, Mississippi Museum of Art|London 1988, cat. #8",3835|3836|3331,,,,455,brueghel_item,brueghel,img/derivatives/simple/3662/thumbnail.jpg,img/derivatives/simple/3662/full.jpg
3676,"<table><tr><td>May 12 1948</td><td>France Paris</td><td>Charpentier (Decock) Lot #61 (as ""Abel Grimmer"")</td></tr><tr><td>20th century</td><td>United States New York NY</td><td>Didier Aaron</td></tr></table>",,,Venetian Harbor Scene,Painting,"Village, Town and Cityscape",Coast Harbor Fishermen Merchants Nobles Seascape Boat,ca. 1600,19.5,23.5,,,Copper,,,,,,,,,,,,,,Produced Outside Jan Brueghel's Studio,"Ertz 2008-10, #Add. 11",,,,,Private,,,,"USA, Mr. and Mrs. Robert Cushman, 1983",6264|6265,"Welu in Worcester 1983, pp. 32-35; Ertz 2008-10, cat. #Add. 11, p. 1643",,,,,,470,brueghel_item,brueghel,img/derivatives/simple/3676/thumbnail.jpg,img/derivatives/simple/3676/full.jpg
3845,"<table><tr><td>1734</td><td>Spain Madrid</td><td>Royal Collection (probably one of four paintings by Jan listed as saved from fire in the Alcazar in 1734)</td></tr><tr><td>1772</td><td>Spain Madrid</td><td>Inventory (mentioned as ""1025 River landscape with ships; in the foreground a child being handed to a gentleman""in the Infanta's dining room of the royal palace)</td></tr><tr><td>Jun 1813</td><td></td><td>Taken at the Battle of Vitoria</td></tr></table>",<a href='/brughel/3492'><img src='/img/derivatives/simple/3492/thumbnail.jpg' /></a>|<a href='/brughel/3495'><img src='/img/derivatives/simple/3495/thumbnail.jpg' /></a>|<a href='/brughel/3485'><img src='/img/derivatives/simple/3485/thumbnail.jpg' /></a>,3492|3495|3485,River with Village and Landing Stage,Painting,"Village, Town and Cityscape",Birds Dog House Landing_stage River Burghers Fishermen Boat Wagon,1606,28.6,42,,,Copper,,BRUEGHEL 1606,,,,,,,,,,,,Jan Brueghel the Elder,"Ertz 2008-10, #120, Ertz 1979, #135, Honig database",135,120,,,Public,England,London,"Wellington Museum, Apsley House",inv. #W.M. 1574-1948 (Black 18),5868|5869|5870,"Ertz 1979, cat. #135, fig. 24; Wellington Museum catalogue 1982, #19, pp. 36-37; Ertz 2008-10, cat. #120",,3492|3495|3485,,,,571,brueghel_item,brueghel,img/derivatives/simple/3845/thumbnail.jpg,img/derivatives/simple/3845/full.jpg
3689,<table><tr><td>Before 1973</td><td>England</td><td>Private Collection</td></tr><tr><td>Mar 21 1973</td><td></td><td>Sale Sotheby's</td></tr><tr><td>1973</td><td>England London</td><td>Gallery L. Koetser</td></tr><tr><td>1974</td><td>Switzerland Geneva</td><td>Gallery David M. Koetser</td></tr><tr><td>Before 1977</td><td>Germany</td><td>Private Collection</td></tr></table>,<a href='/brughel/9802'><img src='/img/derivatives/simple/9802/thumbnail.jpg' /></a>,9802,View Down a River through a Village,Painting,"Village, Town and Cityscape",Traveling Birds Church House River Boat,ca. 1603,18.5,23,,,Copper,,BRUEGHEL,,,,,,,,,,,,Jan Brueghel the Elder,"Ertz 2008-10, #139, Ertz 1979, #96, Honig database",96,139,,,Private,,,,"Sold London, Sotheby's, Dec. 3 2014, lot #27 for 542,000 GBP",6291|6292|6293|6294|6295,"Ertz 1979, cat. #96, fig. 30; Ertz 2008-10, cat. #139",,9802,,7334,,484,brueghel_item,brueghel,img/derivatives/simple/3689/thumbnail.jpg,img/derivatives/simple/3689/full.jpg
3460,<table><tr><td>Jun 16 1980</td><td>England London</td><td>Sale Sotheby's Lot #36</td></tr><tr><td>Jun 15 1983</td><td>England London</td><td>Sale Sotheby's Lot #61</td></tr><tr><td>1983</td><td>England London</td><td>Noortman and Brod</td></tr></table>,<a href='/brughel/3006'><img src='/img/derivatives/simple/3006/thumbnail.jpg' /></a>|<a href='/brughel/3056'><img src='/img/derivatives/simple/3056/thumbnail.jpg' /></a>|<a href='/brughel/3461'><img src='/img/derivatives/simple/3461/thumbnail.jpg' /></a>|<a href='/brughel/3008'><img src='/img/derivatives/simple/3008/thumbnail.jpg' /></a>|<a href='/brughel/3656'><img src='/img/derivatives/simple/3656/thumbnail.jpg' /></a>|<a href='/brughel/3235'><img src='/img/derivatives/simple/3235/thumbnail.jpg' /></a>|<a href='/brughel/3338'><img src='/img/derivatives/simple/3338/thumbnail.jpg' /></a>,3006|3056|3461|3008|3656|3235|3338,Resting at the Windmill,Painting,Landscape,Dog Horse House Windmill Peasants Wagon,1609,12.5,17,,,Copper,,BRUEGHEL 1609,,,,,,,,,,,,Produced in Jan Brueghel's Studio,"Ertz 2008-10, #154, Honig database as uncertain, possibly studio",,154,,,Private,,,,"London, Richard Green Gallery",5799|5800|5801,"Ertz 2008-10, cat. #154",,3006|3056|3461|3008|3656|3235|3338,,,,327,brueghel_item,brueghel,img/derivatives/simple/3460/thumbnail.jpg,img/derivatives/simple/3460/full.jpg
3312,,,,Landscape with Diana and Actaeon,Painting,Classical Mythology,De_Backer Forest Nude Classical History Landscape Mythological Flowers,ca. 1591,37,27,,,Copper,,,,,,Jacob de Backer (ca. 1560-1590/91),,,,,,,,Produced in Jan Brueghel's Studio,"Ertz 2008-10, #358",,358,,,Public,Sweden,Stockholm,Nationalmuseum,#NM 367,,"Ertz 2008-10, cat. #358",,,,,,213,brueghel_item,brueghel,img/derivatives/simple/3312/thumbnail.jpg,img/derivatives/simple/3312/full.jpg
3474,<table><tr><td>Before 1710</td><td>Belgium Antwerp</td><td>Acquired by Raschke von Jacob de Wit</td></tr><tr><td>1710 to 1920</td><td>Germany Dresden</td><td>Royal Gallery</td></tr><tr><td>After 1920</td><td>England London</td><td>Drey Gallery</td></tr><tr><td>Before 1979</td><td>United States Indianapolis IN</td><td>Collection of G.H.A. Clowes</td></tr></table>,<a href='/brughel/3479'><img src='/img/derivatives/simple/3479/thumbnail.jpg' /></a>|<a href='/brughel/3477'><img src='/img/derivatives/simple/3477/thumbnail.jpg' /></a>,3479|3477,River Landscape with Landing Stage,Painting,"Village, Town and Cityscape",Birds Horse House Landing_stage River Peasants Boat Wagon,1612,38.1,61,,,Panel,,BRUEGHEL 1612,,,,,,,,,,,,Jan Brueghel the Elder,"Ertz 2008-10, #107, Ertz 1979, #257, Honig database",257,107,,,Public,United States,"Indianapolis, IN",Indianapolis Museum of Art,"Clowes Collection, inv. #C 10011",5823|5824|5825|5826,"Ertz 1979, Cat. 257, Fig. to come",,3479|3477,,,http://collection.imamuseum.org/artwork/42097/,337,brueghel_item,brueghel,img/derivatives/simple/3474/thumbnail.jpg,img/derivatives/simple/3474/full.jpg
10205,<table><tr><td>1923</td><td>Germany Berlin</td><td>Ksth. Benedict</td></tr><tr><td>Jun 11 1928</td><td>Germany Cologne</td><td>Sold at Auction at Lempertz</td></tr><tr><td>1949</td><td>Switzerland Lucerne</td><td>Collection of Böhler</td></tr><tr><td>1965</td><td>Poland Warsaw</td><td>Collection of the Museum Narodowe</td></tr></table>,,,Landscape with a Bridge and Travelers,Painting,Staffage in Landscape,Traveling Horse Bridge Momper Landscape,,,,,,Panel,,,,,,Joos de Momper (1564-1635),,,,,,,,,,,671,,,Public,Poland,Warsaw,Muzeum Narodowe,VIII-1620,9775|9776|9777|9778,"Ertz 1986, Kat. 152",,,,,,091,brueghel_item,brueghel,img/derivatives/simple/10205/thumbnail.jpg,img/derivatives/simple/10205/full.jpg
9617,<table><tr><td>1875</td><td></td><td>Hausmann</td></tr></table>,,,Winter Scene with Boats and Skaters,Drawing,Landscape,,,18.8,26.5,,,Paper,"Pen and brown ink, gray and blue wash",,,,,,,,,,,,,Jan Brueghel the Elder,Bailey/Walker cat. #BERL.KK.16,,,BERL.KK.16,,Public,Germany,Berlin,"Kupferstichkabinett, Staatliche Museen zu Berlin",KdZ 595,6599,"Bock/Rosenberg 1930, p. 17, nr. 595",,,,,,614,brueghel_item,brueghel,img/derivatives/simple/9617/thumbnail.jpg,img/derivatives/simple/9617/full.jpg
10211,<table><tr><td></td><td></td><td>Kuererzbischöflichen Galerie</td></tr></table>,,,Mountain Landscape with Travelers,Painting,Staffage in Landscape,Traveling Donkey Horse Fort Momper Mountain River Valley Landscape,1600-1610,45.5,73.3,,,Panel,,,,,,Joos de Momper (1564-1635),,,,,,,,Uncertain,,,685,,,Public,Germany,Aschaffenburg,Staatsgalerie im Schloss Johannisburg,6430,9797,"Ertz 1986, Kat. 239, Abb. 10",,,,,,098,brueghel_item,brueghel,img/derivatives/simple/10211/thumbnail.jpg,img/derivatives/simple/10211/full.jpg
3448,<table><tr><td>Before 1986</td><td>Belgium Brussels</td><td>Collection of Charles de Pauw</td></tr><tr><td>Apr 9 1986</td><td>England London</td><td>Sale Sotheby's Lot #5</td></tr><tr><td>Jan 12 1994</td><td>United States New York NY</td><td>Sale Christie's Lot #125</td></tr></table>,,,Reconciliation of Jacob and Esau (Solingen),Painting,Religious,Resting Horse Van_Balen Field Mountain Burghers Children Soldiers Old_Testament,1608-1616,46,68.5,,,Copper,,,,,,Hendrick van Balen (1575-1632),,,,,,,,Produced in Jan Brueghel's Studio,"Ertz 2008-10, #212, Honig database",,212,,,Private,,,,"Solingen, Galerie Muellenmeister",5780|5781|5782,"Greindl 1989, p. 318, fig. 269; Werche 2004, #1; Ertz 2008-10, cat. # 212",,,,,,318,brueghel_item,brueghel,img/derivatives/simple/3448/thumbnail.jpg,img/derivatives/simple/3448/full.jpg
2965,<table><tr><td>1806</td><td>Germany Düsseldorf</td><td>Galerie Düsseldorf inv. #32 (as by Fruelen Brugel)</td></tr><tr><td></td><td>Germany Passau</td><td>Temporarily in Passau where stolen and damaged</td></tr><tr><td>Before 1968</td><td>Germany Düsseldorf</td><td>Recovered and restored</td></tr></table>,,,Baptism of the Ethiopian Eunuch,Painting,Religious,Religious Dog Horse Biblical New_Testament History Landscape,1620-1624,107,191,,,Canvas,,,,,,Joos de Momper (1564-1635),,,,,,,,Produced in Jan Brueghel's Studio,"Ertz 2008-10, #711, Ertz 1979, #424, Munich 2013 as Jan the Younger and Momper",424,711,,,Public,Germany,Munich,Bayerische Staatsgemäldesammlungen,inv. #4672/81,4678|4679|4680,"Ertz 1979, cat. #424, pp. 479, 625; Ertz 1986, #359; Ertz 2008-10, cat. #711, p. 1506","Munich 2009, vol.2, cat. #21",,,,,534,brueghel_item,brueghel,img/derivatives/simple/2965/thumbnail.jpg,img/derivatives/simple/2965/full.jpg
2959,<table><tr><td>Until 1862</td><td>Russia St. Petersburg</td><td>Hermitage</td></tr><tr><td>1862</td><td>Russia St. Petersburg</td><td>Roumianzeff</td></tr></table>,,,Bandit Encounter on the Way to Market,Painting,Landscape,Robbery Traveling Vrancx Road Wagon,ca. 1605,32.5,56.3,,,Panel,,,,,,Sebastiaen Vrancx (1573-1647),,,,,,,,Jan Brueghel the Elder,"Ertz 2008-10, #29",,29,,,Public,Russia,Moscow,Pushkin Museum,,4668|4669,,,,,,,490,brueghel_item,brueghel,img/derivatives/simple/2959/thumbnail.jpg,img/derivatives/simple/2959/full.jpg
9818,<table><tr><td>18th century to 19th century</td><td>Netherlands Utrecht</td><td>F.J.O. Boijmans</td></tr><tr><td>1847</td><td>Netherlands Rotterdam</td><td>Bequeathed to the City of Rotterdam</td></tr><tr><td>1849</td><td>Netherlands Rotterdam</td><td>On permanent loan to Museum Boijmans Van Beuningen</td></tr></table>,,,View of a Village by a River with a Watermill,Drawing,"Village, Town and Cityscape",,,14,21.2,,,Paper,"Pen and brown ink, brush in blue, brown and blue wash, framing lines with the pen in brown ink",,,Collector's mark: Museum Boymans (L.1857),"Verso, center: ""3""; Verso, ""Breugel, 41 / 77""; Verso, ""Breughel de Velours""",,,,,,,,,,Bailey/Walker cat. #ROTT.MB.17,,,ROTT.MB.17,,Public,Netherlands,Rotterdam,Museum Boijmans Van Beuningen,MB 1497 (PK),7214|7215|7216,"Rotterdam 1852, nr. 182 (Jan Brueghel the Elder); Rotterdam 1869, nr. 41; Rotterdam 1901, nr. 77; Bergsträsser 1965, p. 263",,,,7292,http://collectie.boijmans.nl/en/collection/mb-1497-(pk),064,brueghel_item,brueghel,img/derivatives/simple/9818/thumbnail.jpg,img/derivatives/simple/9818/full.jpg
2958,<table><tr><td></td><td>United States New Haven CT</td><td>Egmont Collection Yale Library Transfer</td></tr></table>,,,"Bacchus, Venus, and Ceres",Drawing,Classical Mythology,Tazza Forest Nude Putti Classical Mythological Fruit,ca. 1605,14,14.2,,,Paper,"Pen and brown ink and wash over black chalk, with figures indented during transfer from an earlier drawing",,,,,Hendrick van Balen (1575-1632),,,,,,,,,Bailey/Walker cat. #NEWH.YU.7,,,NEWH.YU.7,,Public,United States,"New Haven, CT",Yale University Art Gallery,1961.61.14,6914,"New Haven 1970, p. 281-2, nr. 518, pl. 278",,,,,http://artgallery.yale.edu/collections/objects/58291,479,brueghel_item,brueghel,img/derivatives/simple/2958/thumbnail.jpg,img/derivatives/simple/2958/full.jpg
2970,<table><tr><td>1979</td><td>Germany Bendorf</td><td>Hardy Collection</td></tr></table>,,,Battle Scene,Painting,Classical History,Battle Death Horse De_Clerck Soldiers Landscape,1609,49,67,,,Copper,,1609,,,,Hendrick de Clerck (1570-1629/30),,,,,,,,Produced Outside Jan Brueghel's Studio,"Ertz 2008-10, #552, Ertz 1979, #200",200,552,,,Private,,,,"Bendorf, Hardy Collection",4690,"Ertz 1979, cat. #200; Ertz 2008-10, cat. #552, pp. 1198",,,,,,559,brueghel_item,brueghel,img/derivatives/simple/2970/thumbnail.jpg,img/derivatives/simple/2970/full.jpg
9831,,,,Women Bleaching,Drawing,"Urban, Common and Peasant Life",,,,,,,Paper,,,,,,,,,,,,,,,Bailey/Walker cat. #STOC.NM.5,,,STOC.NM.5,,Public,Sweden,Stockholm,Nationalmuseum,80,,"Meder-Schoenbrunner 1896, #80; Ertz 1979, p. 491, fig. 593",,,,,,071,brueghel_item,brueghel,img/derivatives/simple/9831/thumbnail.jpg,img/derivatives/simple/9831/full.jpg
2964,"<table><tr><td>Jun 23 2010</td><td>France Paris</td><td>Sale Christie's Lot #23</td></tr><tr><td>Apr 13 2011</td><td>Austria Vienna</td><td>Sale Dorotheum Lot #459 (as ""Jan Brueghel I and Hans Rottenhammer"")</td></tr><tr><td>Dec 4 2012</td><td>England London</td><td>Sale Christie's Lot #21 (for 217,250 GBP)</td></tr></table>",<a href='/brughel/2963'><img src='/img/derivatives/simple/2963/thumbnail.jpg' /></a>|<a href='/brughel/2961'><img src='/img/derivatives/simple/2961/thumbnail.jpg' /></a>|<a href='/brughel/2962'><img src='/img/derivatives/simple/2962/thumbnail.jpg' /></a>,2963|2961|2962,Baptism of Christ (Private Collection),Painting,Religious,Resting Rottenhammer River Children Putti Angels Christ New_Testament,ca. 1608,32.6,48,,,Panel,,,,,,Hans Rottenhammer (1564-1625),,,,,,,,Produced in Jan Brueghel's Studio,"Ertz 2008-10, Add. 30",,,,,Private,,,,Private Collection,4675|4676|4677,"Ertz 2008-10, cat. #Add. 30",,2963|2961|2962,,,,531,brueghel_item,brueghel,img/derivatives/simple/2964/thumbnail.jpg,img/derivatives/simple/2964/full.jpg
3449,<table><tr><td>1809</td><td>Netherlands The Hague</td><td>Cabinet van Heteren</td></tr></table>,<a href='/brughel/3454'><img src='/img/derivatives/simple/3454/thumbnail.jpg' /></a>,3454,Rest on the Flight into Egypt (Amsterdam),Painting,Religious,Resting Forest Christ Holy_family New_Testament Virgin_Mary,ca. 1606,16,12,,,Copper,,BRUEGHEL,,,,,,,,,,,,Produced in Jan Brueghel's Studio,"Ertz 2008-10, #246a, Rijksmuseum website as manner of Jan I Brueghel",,246,,,Public,Netherlands,Amsterdam,Rijksmuseum,inv. #SK-A-69,5783,"Ertz 2008-10, cat. #246a",Amsterdam 2009-10|Maastricht 2010|Utrecht 2014,3454,,,"https://www.rijksmuseum.nl/en/search/objecten?q=jan%20brueghel%20the%20elder&f=1&p=1&ps=12&type=painting&ii=9#/SK-A-69,9",319,brueghel_item,brueghel,img/derivatives/simple/3449/thumbnail.jpg,img/derivatives/simple/3449/full.jpg
10210,<table><tr><td>Mar 27 1952</td><td>France Paris</td><td>Auction at Giroux Nr. 553</td></tr><tr><td></td><td>Switzerland Lugano</td><td>Collection of Baron Thyssen-Bornemisza</td></tr><tr><td></td><td>Italy Campione</td><td>Galleria Silvano Lodi</td></tr><tr><td></td><td>Germany</td><td>Private collection</td></tr><tr><td>1983</td><td>Germany Münster</td><td>Gallery Frye & Sohn</td></tr></table>,,,Travelers on the Pass,Painting,Staffage in Landscape,Traveling Donkey Horse Castle Momper Mountain Valley Landscape,,54,87,,,Panel,,,,,,Joos de Momper (1564-1635),,,,,,,,Uncertain,,,684,,,Private,,,,"Germany, Private Collection",9792|9793|9794|9795|9796,"Ertz 1986, Kat. 238, Abb. 146",,,,,,096,brueghel_item,brueghel,img/derivatives/simple/10210/thumbnail.jpg,img/derivatives/simple/10210/full.jpg
9616,,<a href='/brughel/3781'><img src='/img/derivatives/simple/3781/thumbnail.jpg' /></a>|<a href='/brughel/3785'><img src='/img/derivatives/simple/3785/thumbnail.jpg' /></a>|<a href='/brughel/3222'><img src='/img/derivatives/simple/3222/thumbnail.jpg' /></a>|<a href='/brughel/3507'><img src='/img/derivatives/simple/3507/thumbnail.jpg' /></a>|<a href='/brughel/3509'><img src='/img/derivatives/simple/3509/thumbnail.jpg' /></a>|<a href='/brughel/3508'><img src='/img/derivatives/simple/3508/thumbnail.jpg' /></a>,3781|3785|3222|3507|3509|3508,Wagon on Road through Forest,Drawing,Landscape,,,23.7,37.2,,,Paper,"Pen and brown ink, watercolored, black chalk",,,,,,,,,,,,,Jan Brueghel the Elder,Bailey/Walker cat. #BERL.KK.14,,,BERL.KK.14,,Public,Germany,Berlin,"Kupferstichkabinett, Staatliche Museen zu Berlin",KdZ 763,,"Bock/Rosenberg 1930, p. 16, nr. 763; Essen/Vienna 1997-98, p. 194, fig. 3, nr. 48","Essen/Vienna 1997-98, under nr. 48",3781|3785|3222|3507|3509|3508,,,,613,brueghel_item,brueghel,img/derivatives/simple/9616/thumbnail.jpg,img/derivatives/simple/9616/full.jpg
10204,<table><tr><td>1914</td><td></td><td>Gifted by Karl Hülsenbusch</td></tr><tr><td></td><td>Germany Wuppertal</td><td>Collection of the Von der Heydt Museum</td></tr></table>,,,High Mountains,Painting,Staffage in Landscape,Traveling Horse Momper Lake Mountain Valley Landscape,,46,75,,,Panel,,,,,,Joos de Momper (1564-1635),,,,,,,,Jan Brueghel the Elder,,,669,,,Public,Germany,Wuppertal,Von der Heydt Museum,G 307,9773|9774,"Ertz 1986, Kat. 151",Wuppertal 1985; Beielefield/Baden-Baden 1986; Essen/Wien 2003-04; Wuppertal 2009; Wuppertal 2010,,,,,090,brueghel_item,brueghel,img/derivatives/simple/10204/thumbnail.jpg,img/derivatives/simple/10204/full.jpg
3313,<table><tr><td></td><td>United States New Haven CT</td><td>Egmont Collection Yale Library Transfer</td></tr></table>,,,Landscape with Fort near Harbor,Drawing,Landscape,Fort Harbor Ship,,11.9,31.3,,,Paper,"Pen and brown ink, brush and blue and brown ink, brown and blue wash, traced for transfer",,,,"""P. Brill""",,,,,,,,,,Bailey/Walker cat. #NEWH.YU.27,,,NEWH.YU.27,,Public,United States,"New Haven, CT",Yale University Art Gallery,1961.62.72,6934,"New Haven 1970, p. 291-2, nr. 535",,,,,http://artgallery.yale.edu/collections/objects/58642,214,brueghel_item,brueghel,img/derivatives/simple/3313/thumbnail.jpg,img/derivatives/simple/3313/full.jpg
3475,<table><tr><td>Jun 6 1808</td><td>Netherlands Rotterdam</td><td>Auction of G. van den Pot van Groeneveld</td></tr><tr><td>1909</td><td>Netherlands Amsterdam</td><td>Collection of Moes & van Biema S. 157 Lot #182</td></tr></table>,,,River Landscape with Landing Stage (Amsterdam),Painting,"Village, Town and Cityscape",Birds House Landing_stage River Boat,1604,14.5,20.5,,,Copper,,BRUEGHEL 1604,,,,,,,,,,,,Produced in Jan Brueghel's Studio,"Ertz 2008-10, #118",,118,,,Public,Netherlands,Amsterdam,Rijksmuseum,inv. #SK-A-67,5827|5828,"Wiersum, E. in &apos;&apos;Oud-Holland&apos;&apos;, 48, 1931, p. 211; Thiéry 1953, p. 176; Wilenski, R. H. &apos;&apos;Flemish Painters, 1430-1830&apos;&apos;, 1960, 480; Bille 1961, p. 110; Winner, M. in &apos;&apos;Jahrbuch der Berliner Museen 3&apos;&apos;, 1961, p. 215; Ertz 2008-10, cat. #118; Wheelock 2005, pp.16; Currie & Allart 2012, pp. 135,136",,,,,http://hdl.handle.net/10934/RM0001.COLLECT.8079,338,brueghel_item,brueghel,img/derivatives/simple/3475/thumbnail.jpg,img/derivatives/simple/3475/full.jpg
3688,<table><tr><td>1852</td><td>England London</td><td>Alexander 10th Duke of Hamilton</td></tr><tr><td>1863</td><td>England London</td><td>Inherited by William 12th Duke of Hamilton</td></tr><tr><td>1882</td><td>United States Elmira NY</td><td>Matthias H. Arnot</td></tr><tr><td>1910</td><td>United States Elmira NY</td><td>Donated to the Arnot Art Gallery</td></tr></table>,,,Venus as Ceres with Apollo,Painting,Classical Mythology,Dancing Rottenhammer Nude Putti Classical Landscape Mythological Flowers Musical_instruments,ca. 1595,28.3,20.6,,,Copper,,,,,,Hans Rottenhammer (1564-1625),,,,,,,,Produced in Jan Brueghel's Studio,"Ertz 2008-10, #394",,394,,,Public,United States,"Elmira, NY",Arnot Art Museum,inv. #38,6287|6288|6289|6290,"Ertz 2008-10, cat. #394",,,,,,483,brueghel_item,brueghel,img/derivatives/simple/3688/thumbnail.jpg,img/derivatives/simple/3688/full.jpg
