pid,provenance_html,related_html,related_ids,label,object_type,genre,tags,realdate,height_cm,width_cm,diameter_cm,plate_dimensions,support,drawing_medium,signature,signature_location,support_marks,further_inscription,collaborators,collaborator_notes,collectors_patrons,print_type,print_notes,printmaker,publisher,states,our_attribution,other_attribution_authorities,ertz_1979,ertz_2008,bailey_walker,hollstein_no,collection_type,location_country,location_city,location_collection,location_or_most_recent_sale_notes,provenance,bibliography,exhibition_history,related_works,copies_and_variants,curatorial_files,external_resources,order,layout,collection,thumbnail,full
18584,<table><tr><td></td><td>Switzerland Basel</td><td>The Vischer-Sarasin Family</td></tr><tr><td>20th century</td><td></td><td>The Estate of Marian Sarasin according to label on reverse</td></tr><tr><td>Mar 18 21st century</td><td>Switzerland Zürich</td><td>Anonymous sale Zurich Koller</td></tr></table>,,,The Vision of Saint Hubert,Painting,Religious,,,20.1,23.5,,,,,,,,,,,,,,,,,,,,,,,,,,,"Sotheby's London for 245,000 GBP on July 8th, 2015",8059|8060|8061,"Ertz 2008-10, vol. II, pp. 634 - 36",,,,,,151,brueghel_item,brueghel,img/derivatives/simple/18584/thumbnail.jpg,img/derivatives/simple/18584/full.jpg
3018,<table><tr><td>1618</td><td>Italy Milan</td><td>Donated by Cardinal Borromeo to Ambrosiana</td></tr></table>,,,Carrying of the Cross (Christ & the Holy Women),Painting,Religious,Traveling Horse Borromeo Field Burghers Soldiers Christ New_Testament,ca. 1606,3.5,5,,,Ivory,,,,,,,,Federico Borromeo (1564-1631),,,,,,Jan Brueghel the Elder,"Ertz 2008-10, #318, Ertz 1979, #138, Honig database",138,318,,,Public,Italy,Milan,Ambrosiana,inv. #271 (2),4806,"Ertz 1979, cat. #138; Ertz 2008-10, cat. #318",,,,,,117,brueghel_item,brueghel,img/derivatives/simple/3018/thumbnail.jpg,img/derivatives/simple/3018/full.jpg
3030,<table><tr><td>1958</td><td>United States New York NY</td><td>Julius H. Weitzner</td></tr><tr><td>20th century</td><td>Switzerland Zürich</td><td>Werner and Margaret Abegg Collection</td></tr><tr><td>1972</td><td>Switzerland Riggisberg</td><td>Donated to the Abegg-Stiftung</td></tr></table>,<a href='/brughel/3031'><img src='/img/derivatives/simple/3031/thumbnail.jpg' /></a>|<a href='/brughel/3032'><img src='/img/derivatives/simple/3032/thumbnail.jpg' /></a>|<a href='/brughel/3402'><img src='/img/derivatives/simple/3402/thumbnail.jpg' /></a>|<a href='/brughel/3265'><img src='/img/derivatives/simple/3265/thumbnail.jpg' /></a>|<a href='/brughel/3264'><img src='/img/derivatives/simple/3264/thumbnail.jpg' /></a>|<a href='/brughel/3263'><img src='/img/derivatives/simple/3263/thumbnail.jpg' /></a>|<a href='/brughel/3029'><img src='/img/derivatives/simple/3029/thumbnail.jpg' /></a>,3031|3032|3402|3265|3264|3263|3029,Christ in Limbo (Riggisberg),Painting,Religious,Preaching Bridge Ruins Fire River Nude Christ Demons Hell/Underworld New_Testament,1593,25.6,34.9,,,Copper,,BRUEGHEL . 1593,,,,,,,,,,,,Jan Brueghel the Elder,Honig database,,,,,Public,Switzerland,Riggisberg,Abegg-Stiftung,inv. # 14.119.72,4827|4828|4829,Jolly 2011,,3031|3032|3402|3265|3264|3263|3029,,,,128,brueghel_item,brueghel,img/derivatives/simple/3030/thumbnail.jpg,img/derivatives/simple/3030/full.jpg
3742,<table><tr><td></td><td>United States New Haven CT</td><td>Egmont Collection Yale Library Transfer</td></tr></table>,,,"Virgin Mary and St. Joseph and the Christ Child, St. John, and Angels Playing with the Instruments of Passion",Drawing,Religious,Resting Forest Angels Christ Holy_family New_Testament Saint Virgin_Mary,,22.6,31.8,,,Paper,"Pen and brush, brown ink and brown wash, black chalk",,,,,,,,,,,,,Jan Brueghel the Elder,Bailey/Walker cat. #NEWH.YU.28,,,NEWH.YU.28,,Public,United States,"New Haven, CT",Yale University Art Gallery,1961.65.61,6935,"New Haven 1970, p. 285, nr. 523, pl. 281",,,,,http://artgallery.yale.edu/collections/objects/33892,524,brueghel_item,brueghel,img/derivatives/simple/3742/thumbnail.jpg,img/derivatives/simple/3742/full.jpg
3024,<table><tr><td>1618</td><td>Italy Milan</td><td>Donated by Cardinal Borromeo to Ambrosiana</td></tr></table>,,,Choir of Musical Angels,Painting,Religious,Resting Rottenhammer Borromeo Putti Angels Heaven Old_Testament,ca. 1595,25,35,,,Copper,,,,,,Hans Rottenhammer (1564-1625),,Federico Borromeo (1564-1631),,,,,,Jan Brueghel the Elder,"Ertz 2008-10, #321, Ertz 1979, #124, Honig database",124,321,,,Public,Italy,Milan,Ambrosiana,inv. #70,4813,"Ertz 1979, cat. #124, fig. 609; Pijl in Ambrosiana 2006, 225-6; Borggrefe in Lemgo/Prague 2008, cat. #19, 112-114; Ertz 2008-10,cat. #321","Milan 2002, #84|Lemgo/Prague 2008, #19",,,,http://www.ambrosiana.eu/cms/gloria_d_angeli-1568.html,122,brueghel_item,brueghel,img/derivatives/simple/3024/thumbnail.jpg,img/derivatives/simple/3024/full.jpg
3583,,,,"Study of Monkeys, Birds, and Deer",Oil Sketch,Study,,,20.1,30.9,,,Panel,,,,,,,,,,,,,,Produced in Jan Brueghel's Studio,"Ertz 2008-10, #584a",,584,,,Public,Belgium,Ghent,Museum of Fine Arts,inv. #1902-C,,"Ghent 1905, cat. #142 as David Teniers; Ghent 1909, p. 73 as David Teniers; Ghent 1938, p. 31; Chabot 1951, p. 13-14, cat. #17; Foucart 1980; Foucart in Revue de l&apos;Art 1981, p. 65; Antwerp 1982, cat. #7; Hoozee 1988, p. 34, 39; Hoozee & Tahon 1989, p. 64, abb. 124; Welzel 1997, p. 289; Los Angeles/The Hague 2006/2007, p. 206, fig. 103; Ertz 2008-10, Cat. 584a",,,,,https://www.mskgent.be/en/featured-item/study-monkeys-deer-and-other-animals,419,brueghel_item,brueghel,img/derivatives/simple/3583/thumbnail.jpg,img/derivatives/simple/3583/full.jpg
3568,<table><tr><td></td><td>Germany Munich</td><td>Bayerische Staatsgemäldesammlungen inv. #825</td></tr><tr><td>1922</td><td></td><td>Sale Sotheby's Lot #19</td></tr></table>,<a href='/brughel/3566'><img src='/img/derivatives/simple/3566/thumbnail.jpg' /></a>|<a href='/brughel/3567'><img src='/img/derivatives/simple/3567/thumbnail.jpg' /></a>|<a href='/brughel/3569'><img src='/img/derivatives/simple/3569/thumbnail.jpg' /></a>,3566|3567|3569,St. Martin Dividing His Cloak (Munich),Painting,Religious,Preaching Horse House Windmill Field Burghers Children New_Testament Saint Wagon,ca. 1611,20,30,,,Copper,,,,,,,,,,,,,,Produced in Jan Brueghel's Studio,"Ertz 2008-10, #311, Ertz 1979, #243, Honig database as Jan and studio",243,311,,,Private,,,,"Munich, Gallery Heinmann",6027|6028,"Ertz 1979, cat. #243, fig. 275; Ertz 2008-10, cat. #311",,3566|3567|3569,,,,415,brueghel_item,brueghel,img/derivatives/simple/3568/thumbnail.jpg,img/derivatives/simple/3568/full.jpg
9737,<table><tr><td></td><td>United States New Haven CT</td><td>Egmont Collection Yale Library Transfer</td></tr></table>,,,Rocky Landscape (Yale),Drawing,Landscape,Village,,19.2,31.2,,,Paper,"Brush and blue and brown ink, blue and brown wash",,,,"""p. bril""",,,,,,,,,,Bailey/Walker cat. #NEWH.YU.24,,,NEWH.YU.24,,Public,United States,"New Haven, CT",Yale University Art Gallery,1961.62.53,6931,"New Haven 1970, p. 290, nr. 532",,,,,http://artgallery.yale.edu/collections/objects/58610,032,brueghel_item,brueghel,img/derivatives/simple/9737/thumbnail.jpg,img/derivatives/simple/9737/full.jpg
3554,<table><tr><td></td><td>Netherlands Apeldoorn</td><td>Collection of Princes of Oranges Het Loo Palace</td></tr><tr><td>1713</td><td></td><td>Sale</td></tr></table>,<a href='/brughel/3837'><img src='/img/derivatives/simple/3837/thumbnail.jpg' /></a>|<a href='/brughel/3393'><img src='/img/derivatives/simple/3393/thumbnail.jpg' /></a>,3837|3393,Sleeping Nymphs Spied Upon by Satyrs,Painting,Classical Mythology,Birds Deer Rubens Forest Nude Classical History Mythological,1620-1621,66,109,,,Panel,,,,,,Peter Paul Rubens (1577-1632),,,,,,,,Produced in Jan Brueghel's Studio,"Ertz 1979, #358, Munich 2013 as Jan and studio with Rubens' studio, Honig database as Jan and studio",358,,,,Public,Germany,Munich,Alte Pinakothek,inv. #344,5999|6000,"Ertz 1979, cat. #358; Munich 2013, p. 370, cat. #83",Munich 2013,3837|3393,,,,401,brueghel_item,brueghel,img/derivatives/simple/3554/thumbnail.jpg,img/derivatives/simple/3554/full.jpg
3226,<table><tr><td>1746</td><td>Spain Madrid</td><td>La Granja Inventory of 1746</td></tr><tr><td></td><td>Spain Madrid</td><td>Later in Palacio de Aranjuez</td></tr></table>,<a href='/brughel/3224'><img src='/img/derivatives/simple/3224/thumbnail.jpg' /></a>|<a href='/brughel/3225'><img src='/img/derivatives/simple/3225/thumbnail.jpg' /></a>|<a href='/brughel/3223'><img src='/img/derivatives/simple/3223/thumbnail.jpg' /></a>|<a href='/brughel/3667'><img src='/img/derivatives/simple/3667/thumbnail.jpg' /></a>|<a href='/brughel/3842'><img src='/img/derivatives/simple/3842/thumbnail.jpg' /></a>,3224|3225|3223|3667|3842,Forest Road with Travelers (Madrid),Painting,Landscape,Battle,ca. 1612,47,80,,,Panel,,,,,,,,,,,,,,Produced in Jan Brueghel's Studio,Honig database as a weak copy of the version in the Metropolitan Museum,,,,,Public,Spain,Madrid,Museo del Prado,inv. #1885,5299|5300,"Wurzbach 1910, p. 824; Legrand 1963, p. 200; Madrid 1975, p. 58","Santiago de Compostela 2011, cat. #4",3224|3225|3223|3667|3842,,,https://www.museodelprado.es/coleccion/obra-de-arte/bosque-con-carretas-atravesando-un-arroyo-y/1ce44a87-f8e3-41f1-8526-2f4a05b0e43b,188,brueghel_item,brueghel,img/derivatives/simple/3226/thumbnail.jpg,img/derivatives/simple/3226/full.jpg
9750,<table><tr><td>Jun 3</td><td></td><td>Sale Sotheby's Lot #124</td></tr><tr><td></td><td>United States New York NY</td><td>Private Collection</td></tr><tr><td></td><td>United States New York NY</td><td>Sale Bob P. Haboldt & Co.</td></tr><tr><td></td><td>United States New York NY</td><td>Eugene V. and Clare E. Thaw</td></tr></table>,,,View of the Tiber with the Ponte Sisto and Saint Peter’s in the Distance,Drawing,"Village, Town and Cityscape",,ca. 1595,16,25.5,,,Paper,"Pen and brown ink, brown and blue watercolor.",,,Collector's mark: (UR) unidentified,"UR: ""Paolo Veronese""",,,,,,,,,Jan Brueghel the Elder,Bailey/Walker cat. #NY.PM.3,,,NY.PM.3,,Public,United States,"New York, NY",Pierpont Morgan Library,EVT 13,6997|6998|6999|7000,"Winner 1985, p. 87-9, fig. 9; Washington/New York 1986-87, nr. 23; New York 1990-91, p. 2, repr.; New York 1994, p. 35-8, nr. 11","Washington/New York 1986-87, nr. 23|New York 1994, nr. 11",,,,http://corsair.themorgan.org/cgi-bin/Pwebrecon.cgi?BBID=247053,037,brueghel_item,brueghel,img/derivatives/simple/9750/thumbnail.jpg,img/derivatives/simple/9750/full.jpg
9744,<table><tr><td></td><td></td><td>James Jackson Jarves</td></tr><tr><td>19th century</td><td>United States Staten Island NY</td><td>Cornelius Vanderbilt</td></tr><tr><td>1880</td><td></td><td>Gift of Cornelius Vanderbilt</td></tr></table>,,,River Scene,Drawing,Landscape,,,13.3,19.1,,,Paper,"Pen and brown ink, brown, and red wash, over black chalk; framing lines in brown ink",,,,"UR: ""CD""? (traces of a 'paraphe'); Verso, UL: ""464""; Verso, UC: ""Ruysdael""; Verso, center: ""40""; Verso, ""464 429"" (crossed out); Verso, ""4"" (faded)",,,,,,,,,,Bailey/Walker cat. #NY.MM.6,,,NY.MM.6,,Public,United States,"New York, NY",Metropolitan Museum of Art,80.3.464,6968|6969|6970,"New York 1895, nr. 464, 29","New York 1895, nr. 464, 29",,,,http://www.metmuseum.org/collection/the-collection-online/search/335117,033,brueghel_item,brueghel,img/derivatives/simple/9744/thumbnail.jpg,img/derivatives/simple/9744/full.jpg
3533,<table><tr><td>1910</td><td></td><td>Bequeathed by Toeppfer</td></tr></table>,<a href='/brughel/3453'><img src='/img/derivatives/simple/3453/thumbnail.jpg' /></a>,3453,Sacrifice of Isaac (Geneva),Painting,Religious,Preaching Forest Mountain Burghers Angels Old_Testament,,,,21,,Panel,,,,,,,,,,,,,,Jan Brueghel the Elder,"Ertz 2008-10, #209, Ertz 1979, #71, Honig database",71,209,,,Public,Switzerland,Geneva,Musée d'Art et d'Histoire,inv. #1910-149,5969,"Ertz 1979, cat. #71, fig. 256; Russell 1989, #10; Ertz 2008-10, cat. #209","Miami Beach 1989|Oberlin/Washington 1989-90, #10",3453,,,,383,brueghel_item,brueghel,img/derivatives/simple/3533/thumbnail.jpg,img/derivatives/simple/3533/full.jpg
9778,,,,Archduke Albert of Austria with Women on a Platform,Drawing,Portrait,,1606-1625,16.9,27.4,,,Paper,Black chalk,,,,"""swert""; RC: ""hout""",,,,,,,,,Jan Brueghel the Elder,Bailey/Walker cat. #PARI.LC.5,,,PARI.LC.5,,Public,France,Paris,Fondation Custodia (Collection Frits Lugt),I 3794 recto,,"Zwollo 2000, p. 449 ev., fig. 6",,,,,https://rkd.nl/explore/images/62293,049,brueghel_item,brueghel,img/derivatives/simple/9778/thumbnail.jpg,img/derivatives/simple/9778/full.jpg
9793,<table><tr><td>17th century</td><td>France Paris</td><td>Everhard Jabach (Lugt 2959) Inventory #229 (as Brueghel le Jeune</td></tr><tr><td></td><td>France Paris</td><td>Purchased for the Royal Cabinet of King Louis XIV (Lugt 2961)</td></tr></table>,,,"River with Boats, Lined with Trees and Houses",Drawing,"Village, Town and Cityscape",,,19,19.5,,,Paper,,,,,,,,,,,,,,,Bailey/Walker cat. #PARI.ML.24,,,PARI.ML.24,,Public,France,Paris,Musée du Louvre,INV 19741,7122|7123,"Lugt 1949, nr. 496",,,,,http://arts-graphiques.louvre.fr/detail/oeuvres/1/109883-Riviere-avec-des-barques-et-des-cannots-bordee-darbres-et-de-maisons,052,brueghel_item,brueghel,img/derivatives/simple/9793/thumbnail.jpg,img/derivatives/simple/9793/full.jpg
3719,<table><tr><td></td><td>United States New Haven CT</td><td>Egmont Collection Yale Library Transfer</td></tr></table>,<a href='/brughel/3433'><img src='/img/derivatives/simple/3433/thumbnail.jpg' /></a>|<a href='/brughel/3099'><img src='/img/derivatives/simple/3099/thumbnail.jpg' /></a>,3433|3099,Village Meeting Place under Two Old Trees,Drawing,"Village, Town and Cityscape",Village,ca. 1612,28,40.9,,,Paper,"Pen and brown ink, watercolor",,,,"""J. Breugel"" and ""1642"" and ""PH.""; ""35"" and ""Ja Brugel called Velvet Brugel/[cross]1642""",,,,,,,,,,Bailey/Walker cat. #NEWH.YU.12,,,NEWH.YU.12,,Public,United States,"New Haven, CT",Yale University Art Gallery,1961.62.25,6919,"New Haven 1970, p. 285-6, nr. 524, pl. 280; Winner 1972, p. 150, fig. 32",,3433|3099,,,http://artgallery.yale.edu/collections/objects/58557,502,brueghel_item,brueghel,img/derivatives/simple/3719/thumbnail.jpg,img/derivatives/simple/3719/full.jpg
3725,<table><tr><td></td><td></td><td>Jacques Tranchez</td></tr><tr><td>17th century</td><td>Belgium Antwerp</td><td>Van Cauwenberghs</td></tr></table>,<a href='/brughel/3477'><img src='/img/derivatives/simple/3477/thumbnail.jpg' /></a>,3477,Village Square,Drawing,"Urban, Common and Peasant Life",Horse Village Peasants Road Wagon,,21.2,33,,,Paper,,,,,annotated Bruegel; Watermark: shield with cornet de poste and topped with crown,,,,,,,,,,Bailey/Walker cat. #ANTW.PM.8,,,ANTW.PM.8,,Public,Belgium,Antwerp,Museum Plantin-Moretus,PK.OT.00234; A.39.3,6580|6581,"Delen 1938, p. 56, nr. 170",,3477,,660,http://search.museumplantinmoretus.be/Details/collect/276965,508,brueghel_item,brueghel,img/derivatives/simple/3725/thumbnail.jpg,img/derivatives/simple/3725/full.jpg
3043,,<a href='/brughel/3042'><img src='/img/derivatives/simple/3042/thumbnail.jpg' /></a>|<a href='/brughel/3044'><img src='/img/derivatives/simple/3044/thumbnail.jpg' /></a>,3042|3044,Coastal Landscape with Temple of Vesta (Choiseul),Painting,Landscape,Temple Roundel Coast Fishermen Ship,,,,,,Panel,,,,,,,,,,,,,,Produced Outside Jan Brueghel's Studio,"Ertz 1979, #75",75,,,,Private,,,,Formerly collection of the Duc de Choiseul,,"Ertz 1979, cat. #75, Fig. 201",,3042|3044,,,,136,brueghel_item,brueghel,img/derivatives/simple/3043/thumbnail.jpg,img/derivatives/simple/3043/full.jpg
3731,<table><tr><td>2000</td><td>United States New York NY</td><td>Gallery of Adam Williams</td></tr><tr><td>Jan 28 2000</td><td>United States New York NY</td><td>Sale Sotheby's Lot #49</td></tr></table>,,,Village Street with Drinking Horse,Painting,"Village, Town and Cityscape",Cattle Horse Village Burghers Cart,1613,26.1,35.7,,,Copper,,BRUEGHEL 1613,,,,,,,,,,,,Produced in Jan Brueghel's Studio,"Ertz 2008-10, #177",,177,,,Private,,,,"London, Verner Amell Ltd.",6392|6393,,,,,,,513,brueghel_item,brueghel,img/derivatives/simple/3731/thumbnail.jpg,img/derivatives/simple/3731/full.jpg
9585,,,,The Fisherman,Print,Landscape,Everyday_life Farming House Forest Lake Fishermen,1650,12.1,17.8,,,,,,,,"first state: Brueghel pinxit, W:Hollar fecit 1652, I Meyssens excudit.;second state: added ""buyten Brussel""",,,,Etching,,Wenceslaus Hollar,Jan Meyssens,3,,Hollstein No. Hollar 1103,,,,Hollar 1103,Unknown/Not Applicable,,,,,,Ertz 490; New Hollstein 1103,,,,,http://www.britishmuseum.org/research/collection_online/collection_object_details.aspx?assetId=48067001&objectId=1504400&partId=1,606,brueghel_item,brueghel,img/derivatives/simple/9585/thumbnail.jpg,img/derivatives/simple/9585/full.jpg
10197,<table><tr><td></td><td>Denmark Copenhagen</td><td>Collection at the Rosenborg Castle</td></tr></table>,<a href='/brughel/10198'><img src='/img/derivatives/simple/10198/thumbnail.jpg' /></a>|<a href='/brughel/10203'><img src='/img/derivatives/simple/10203/thumbnail.jpg' /></a>,10198|10203,Large Panoramic Mountain View with Venus and Adonis,Painting,Staffage in Landscape,Series Animals Dog Momper Forest Allegory Classical Landscape Mythological,1605-1610,43,66.5,,,Panel,,,,,,"Hendrick van Balen (1575-1632), Joos de Momper (1564-1635)",,,,,,,,Jan Brueghel the Elder,,,638,,,Public,Denmark,Copenhagen,Rosenborg Castle,,9764,"Ertz 1986, Kat. 550, Abb. 378",,10198|10203,,,,082,brueghel_item,brueghel,img/derivatives/simple/10197/thumbnail.jpg,img/derivatives/simple/10197/full.jpg
3679,<table><tr><td>Since 1979</td><td></td><td>Collection of Albert de Rykman de Betz</td></tr><tr><td>Jul 8 1994</td><td>England London</td><td>Sale Christie's Lot #57</td></tr><tr><td>2006</td><td>Netherlands</td><td>Arthes</td></tr></table>,,,Venus Mourning the Death of Adonis,Painting,Classical Mythology,Birds De_Clerck Forest Stream Nude Classical History Landscape Mythological,ca. 1610,53.2,85,,,Panel,,,,,,Hendrick de Clerck (1570-1629/30),Circle of Hendrick de Clerck,,,,,,,Produced in Jan Brueghel's Studio,"Ertz 2008-10, #389",,389,,,Private,,,,"Paris, Galerie Gombert, 2008",6271|6272|6273,"Ertz 2008-10, cat. #389",,,,,,473,brueghel_item,brueghel,img/derivatives/simple/3679/thumbnail.jpg,img/derivatives/simple/3679/full.jpg
3651,<table><tr><td>1642</td><td>Spain Leganés</td><td>Collection of Don Diego Mexia marquis of Leganés</td></tr><tr><td>1655</td><td>Spain Leganés</td><td>Collection of Don Diego Mexia marquis of Leganés</td></tr><tr><td>1686</td><td>Spain Madrid</td><td>Alcázar</td></tr><tr><td>1734</td><td>Spain Madrid</td><td>Moved to Palacio Nuevo</td></tr><tr><td>1819</td><td>Spain Madrid</td><td>Transferred to Museo del Prado</td></tr></table>,<a href='/brughel/3650'><img src='/img/derivatives/simple/3650/thumbnail.jpg' /></a>,3650,The Vision of St. Hubert (Madrid),Painting,Religious,Resting Deer Horse Rubens Forest New_Testament Saint,ca. 1617-ca. 1621,63,100,,,Panel,,,,,,Peter Paul Rubens (1577-1632),,,,,,,,Jan Brueghel the Elder,"Ertz 2008-10, #304, Ertz 1979, #366, Honig database",366,304,,,Public,Spain,Madrid,Museo del Prado,inv. #1411,6205|6206|6207|6208|6209,"Rooses 1886-92, vol. 2; De Maeyer 1955, p. 155; Díaz Padrón 1975, pp. 65-67; Ertz 1979, cat. #366, fig. 469; Diaz Padron 1995, vol.1,  pp. 288-89; Crawford-Volk 1980, p. 267; Jaffé 1989, cat. #470, p. 235; Vergara 1999, pp. 171-72; Van Mulders 2000, p. 121; Ertz 2008-10, cat. #304","Los Angeles/The Hague 2006, #7|Santiago de Compostela 2011, cat. #15|Munich 2013, #88",3650,,,https://www.museodelprado.es/coleccion/obra-de-arte/la-vision-de-san-huberto/79d8949b-15e5-4de2-8aad-6b9e2bdaf95f,451,brueghel_item,brueghel,img/derivatives/simple/3651/thumbnail.jpg,img/derivatives/simple/3651/full.jpg
5552,,,,The Palace of Isabella Clara Eugenia at Tervuren,Painting,Landscape,Birds Dog Horse Bridge Castle Pond Archdukes Landscape,,126,153,,,Canvas,,,,,,,,,,,,,,Produced in Jan Brueghel's Studio,"Ertz 2008-10, #565 as Jan the Younger, Honig Database as Jan the Younger",,565,,,Public,Spain,Madrid,Museo del Prado,inv. 1453,,"Ertz 2008-10, cat. #565","Santiago de Compostela 2011, cat. #30",,,,,596,brueghel_item,brueghel,img/derivatives/simple/5552/thumbnail.jpg,img/derivatives/simple/5552/full.jpg
3692,<table><tr><td>Mar 11 1952 to Mar 18</td><td>Netherlands Amsterdam</td><td>Auction M. Mossel Lot #659</td></tr></table>,,,View of Antwerp from the Scheldt,Painting,Landscape,Birds Panorama River Landscape Boat,1610,36.8,63,,,Panel,,J. BRUEGHEL 1610,,,,,,,,,,,,Produced in Jan Brueghel's Studio,,,,,,Private,,,,Dutch Private Collection,6298,"Thiéry 1953, p. 176","Christmas exposition, Museum Boymans, Rotterdam, 1945-1946|Ghent, February-March 1961, cat. #17|Singer Museum, Laren, 1963, cat. #37|''The Century of Rubens'', Koninklijk Museum voor Schone Kunsten, Brussels, 1965, cat. #20|The Mauritshuis, The Hague, on loan, 1975",,,,,487,brueghel_item,brueghel,img/derivatives/simple/3692/thumbnail.jpg,img/derivatives/simple/3692/full.jpg
3686,,,,Venus and Mars Surprised by Vulcan,Painting,Classical Mythology,Van_Balen Nude Putti Classical History Mythological Flowers,ca. 1606,61.5,44,,,,,,,Mark of Peeter Stas,,Hendrick van Balen (1575-1632),,,,,,,,Produced Outside Jan Brueghel's Studio,"Ertz 2008-10, #395",,395,,,Private,,,,"London, Sotheby's, April 26, 2001, #14",,"Ertz 2008-10, cat. #395",,,,,,481,brueghel_item,brueghel,img/derivatives/simple/3686/thumbnail.jpg,img/derivatives/simple/3686/full.jpg
3309,<table><tr><td>19th century to 20th century</td><td>United States New York NY</td><td>Victor Spark Gallery</td></tr><tr><td>1953</td><td>United States Richmond VA</td><td>The Virginia Museum of Fine Arts (purchased with the support of the Williams Fund)</td></tr></table>,<a href='/brughel/3287'><img src='/img/derivatives/simple/3287/thumbnail.jpg' /></a>|<a href='/brughel/2951'><img src='/img/derivatives/simple/2951/thumbnail.jpg' /></a>|<a href='/brughel/2950'><img src='/img/derivatives/simple/2950/thumbnail.jpg' /></a>|<a href='/brughel/3832'><img src='/img/derivatives/simple/3832/thumbnail.jpg' /></a>|<a href='/brughel/3610'><img src='/img/derivatives/simple/3610/thumbnail.jpg' /></a>|<a href='/brughel/3695'><img src='/img/derivatives/simple/3695/thumbnail.jpg' /></a>,3287|2951|2950|3832|3610|3695,Landscape with Archduke Albert and Mariemont Castle,Painting,Landscape,Horse Castle Mariemont Nobles Telescope,ca. 1609,85,127,,,Canvas,,,,,,,,,,,,,,Jan Brueghel the Elder,"Ertz 2008-10, #556, Ertz 1979, #177, Honig database",177,556,,,Public,United States,"Richmond, VA",The Virginia Museum of Fine Arts,"The Williams Fund, inv. #53-10",5472|5473,"Ertz 1979, cat. #177, fig. 171; Molaro & Selvelli 2008; Ertz 2008-10, cat. #556, pp. 1206–7; Mason 2012, p. 53",,3287|2951|2950|3832|3610|3695,,,,211,brueghel_item,brueghel,img/derivatives/simple/3309/thumbnail.jpg,img/derivatives/simple/3309/full.jpg
9630,,,,River with Sailboats,Drawing,Landscape,,,18.1,30.9,,,Paper,"Pen and brown ink, blue and gray wash",,,,Watermark (not described),,,,,,,,,,Bailey/Walker cat. #BRAU.HA.11,,,BRAU.HA.11,,Public,Germany,Braunschweig,Herzog Anton Ulrich Museum (Kupferstichkabinett),Z 2357,,,,,,,http://kulturerbe.niedersachsen.de/viewer/piresolver?id=isil_DE-MUS-026819_993,618,brueghel_item,brueghel,img/derivatives/simple/9630/thumbnail.jpg,img/derivatives/simple/9630/full.jpg
10222,<table><tr><td></td><td>Netherlands</td><td>In a private collection</td></tr><tr><td>Nov 22 1989</td><td>Netherlands Amsterdam</td><td>Sale at Sotheby's Nr. 38</td></tr><tr><td>1991</td><td>France Paris</td><td>Gallery of Jonckheere Nr. 4</td></tr><tr><td>1991/1992</td><td>Switzerland Zürich</td><td>Koetser Gallery</td></tr><tr><td>Jul 12 2001</td><td>England London</td><td>Sale at Sotheby's Nr. 27</td></tr></table>,,,Winter Village with Travelers,Painting,Staffage in Landscape,Everyday_life Village Momper Peasants Cityscape Cart Wagon,,46,75,,,Panel,,,,,,Joos de Momper (1564-1635),,,,,,,,,,,785,,,Private,,,,"Sotheby's, London, 7 July 2001, Nr. 27",9814|9815|9816|9817|9818,,,,,,,109,brueghel_item,brueghel,img/derivatives/simple/10222/thumbnail.jpg,img/derivatives/simple/10222/full.jpg
3335,<table><tr><td></td><td></td><td>R.B. Meyer</td></tr></table>,,,Landscape with Windmill (Cambridge),Painting,Landscape,Traveling Dog Horse Windmill Wagon,ca. 1611,17,22.3,,,Copper,,,,,,,,,,,,,,Produced in Jan Brueghel's Studio,"Ertz 2008-10, Add. 29",,,,,Public,England,Cambridge,Fitzwilliam Museum,3 PD.186-1975,5519,"Ertz 2008-10, cat. Add. 29",,,,,,220,brueghel_item,brueghel,img/derivatives/simple/3335/thumbnail.jpg,img/derivatives/simple/3335/full.jpg
9618,<table><tr><td>1874</td><td>Germany Aachen</td><td>Barthold Suermondt (Lugt 415)</td></tr></table>,,,"Three Wagons; Wagons, Horses, and Peasants (verso)",Drawing,"Urban, Common and Peasant Life",,,8.5,15.6,,,Paper,Pen and brown ink,,,,,,,,,,,,,Jan Brueghel the Elder,Bailey/Walker cat. #BERL.KK.17,,,BERL.KK.17,,Public,Germany,Berlin,"Kupferstichkabinett, Staatliche Museen zu Berlin",KdZ 756,6600,"Bock/Rosenberg 1930, p. 17, nr. 756",,,,,,615,brueghel_item,brueghel,img/derivatives/simple/9618/thumbnail.jpg,img/derivatives/simple/9618/full.jpg
18656,,,,Continence of Scipio (Dresden),Painting,Classical History,,1600,79.5,148,,,,,,,,,,,,,,,,,Produced in Jan Brueghel's Studio,,,,,,Public,Germany,Dresden,"Staatliche Kunstsammlungen Dresden, Gemäldegalerie Alte Meister",,,,,,,,,165,brueghel_item,brueghel,img/derivatives/simple/18656/thumbnail.jpg,img/derivatives/simple/18656/full.jpg
