pid,provenance_html,related_html,related_ids,label,object_type,genre,tags,realdate,height_cm,width_cm,diameter_cm,plate_dimensions,support,drawing_medium,signature,signature_location,support_marks,further_inscription,collaborators,collaborator_notes,collectors_patrons,print_type,print_notes,printmaker,publisher,states,our_attribution,other_attribution_authorities,ertz_1979,ertz_2008,bailey_walker,hollstein_no,collection_type,location_country,location_city,location_collection,location_or_most_recent_sale_notes,provenance,bibliography,exhibition_history,related_works,copies_and_variants,curatorial_files,external_resources,order,layout,collection,thumbnail,full
3561,<table><tr><td>1792</td><td></td><td>de Cazotte Collection until his execution</td></tr><tr><td>1792</td><td>France Châlons-en-Champagne</td><td>Département-Museum</td></tr><tr><td>1861</td><td></td><td>Musée Municipal of Châlons-sur-Marnes since its founding</td></tr></table>,,,Snowy Village on a HIll,Painting,Staffage in Landscape,Skating Horse Church Village Momper Snow Valley Peasants Landscape Cart,1620-1624,170,267,,,Canvas,,,,,,Joos de Momper (1564-1635),,,,,,,,Produced in Jan Brueghel's Studio,"Ertz 2008-10, #783",,783,,,Public,France,Châlone-sur-Marne,Musée Municipal,,6011|6012|6013,"Ertz 2008-10, cat. 783",,,,,,408,brueghel_item,brueghel,img/derivatives/simple/3561/thumbnail.jpg,img/derivatives/simple/3561/full.jpg
9727,<table><tr><td>1829</td><td></td><td>Gift of Collection Xavier Atger Inv. #MA 487</td></tr></table>,,,"Trees, Birds, Fruits, and Flowers",Drawing,Flower Still-Life & Nature Study,,,48.7,38.4,,,Paper,"Pen and brown ink, watercolor, white gouache","""Brughels fecit""",,,,,,,,,,,,,Bailey/Walker cat. #MONT.MA.1,,,MONT.MA.1,,Public,France,Montpellier,Musée Atger,MA 487,6889,"Kühnholtz 1830, nr. 104; Nicq and Nicq 1997, p. 120-121, nr. 79; Lodève 2008, p. 190-1, nr. 86","Lodève 2008, nr. 86",,,,,025,brueghel_item,brueghel,img/derivatives/simple/9727/thumbnail.jpg,img/derivatives/simple/9727/full.jpg
2882,<table><tr><td>Until 1915</td><td>Russia</td><td>Collection of Semenor-Tjanschanski</td></tr></table>,<a href='/brughel/2876'><img src='/img/derivatives/simple/2876/thumbnail.jpg' /></a>|<a href='/brughel/2880'><img src='/img/derivatives/simple/2880/thumbnail.jpg' /></a>|<a href='/brughel/2883'><img src='/img/derivatives/simple/2883/thumbnail.jpg' /></a>|<a href='/brughel/2877'><img src='/img/derivatives/simple/2877/thumbnail.jpg' /></a>|<a href='/brughel/2881'><img src='/img/derivatives/simple/2881/thumbnail.jpg' /></a>|<a href='/brughel/2878'><img src='/img/derivatives/simple/2878/thumbnail.jpg' /></a>|<a href='/brughel/2879'><img src='/img/derivatives/simple/2879/thumbnail.jpg' /></a>,2876|2880|2883|2877|2881|2878|2879,Adoration of the Magi (St. Petersburg),Painting,Religious,Resting Horse Bridge House Pieter_Bruegel River Burghers Children Soldiers Christ New_Testament Virgin_Mary,1598-1600,26.5,35.2,,,Copper,,BRUEGHEL,,,,,,,,,,,,Jan Brueghel the Elder,"Ertz 2008-10, #228, Ertz 1979, #50, Honig database",50,228,,,Public,Russia,St. Petersburg,The Hermitage,inv. #3090,4455,"Ertz 1979, cat. #50, fig. 508; Ertz 2008-10, cat. #228",,2876|2880|2883|2877|2881|2878|2879,,,,593,brueghel_item,brueghel,img/derivatives/simple/2882/thumbnail.jpg,img/derivatives/simple/2882/full.jpg
3544,<table><tr><td></td><td>United States New Haven CT</td><td>Egmont Collection Yale Library Transfer</td></tr></table>,,,Seagoing Vessels at Anchor in Calm Water,Drawing,Seascape,Seascape Ship,,11.8,18.5,,,Paper,Pen and brown ink over preliminary drawing in black chalk or graphite,,,,"""Peter Breugel the elder""",,,,,,,,,,Bailey/Walker cat. #NEWH.YU.3,,,NEWH.YU.3,,Public,United States,"New Haven, CT",Yale University Art Gallery,1961.62.9,6910,"New Haven 1970, p. 295, nr. 543, pl. 287",,,,,http://artgallery.yale.edu/collections/objects/58530,392,brueghel_item,brueghel,img/derivatives/simple/3544/thumbnail.jpg,img/derivatives/simple/3544/full.jpg
3550,<table><tr><td>1753</td><td>England London</td><td>Bequeathed by Sir Hans Sloane</td></tr></table>,<a href='/brughel/2976'><img src='/img/derivatives/simple/2976/thumbnail.jpg' /></a>,2976,Sheet of Various Studies for a PIcture of the Terrestrial Paradise,Drawing,Study,Birds Cattle Deer Dog Horse Lion Monkey Fruit,1604,19.3,30.7,,,Paper,Pen and brown ink,,,,,,,,,,,,,Jan Brueghel the Elder,Bailey/Walker cat. #LOND.BM.16,,,LOND.BM.16,,Public,England,London,British Museum,"RN SL,5214.166",6825,"Hind 1915, nr. 11; Los Angeles/The Hague 2006-07, p. 222, fig. 114",,2976,,7285,http://www.britishmuseum.org/research/collection_online/collection_object_details.aspx?objectId=712247&partId=1&searchText=SL%2C5214.166&view=list&page=1,398,brueghel_item,brueghel,img/derivatives/simple/3550/thumbnail.jpg,img/derivatives/simple/3550/full.jpg
3020,<table><tr><td></td><td>United States New Haven CT</td><td>Egmont Collection Yale Library Transfer</td></tr></table>,,,Castle on the Seashore,Drawing,Landscape,Castle Ship,,19.3,31.1,,,Paper,"Pen and brown ink, brush and brown and blue ink, blue wash",,,,"""Paul Brill""",,,,,,,,,,Bailey/Walker cat. #NEWH.YU.20,,,NEWH.YU.20,,Public,United States,"New Haven, CT",Yale University Art Gallery,1961.62.43,6927,"New Haven 1970, p. 288, nr. 528",,,,,http://artgallery.yale.edu/collections/objects/58595,118,brueghel_item,brueghel,img/derivatives/simple/3020/thumbnail.jpg,img/derivatives/simple/3020/full.jpg
3785,<table><tr><td></td><td>Germany Munich</td><td>Alte Pinakothek inv. #693 (?131)</td></tr><tr><td>1935</td><td></td><td>Sale</td></tr><tr><td>1936</td><td>Germany Düsseldorf</td><td>Gallery Stern</td></tr><tr><td>1990</td><td>Germany Munich</td><td>Gallery Bernheimer</td></tr><tr><td>1995</td><td>United States New York NY</td><td>Gallery Naumann</td></tr></table>,<a href='/brughel/3507'><img src='/img/derivatives/simple/3507/thumbnail.jpg' /></a>|<a href='/brughel/3508'><img src='/img/derivatives/simple/3508/thumbnail.jpg' /></a>|<a href='/brughel/3509'><img src='/img/derivatives/simple/3509/thumbnail.jpg' /></a>|<a href='/brughel/9616'><img src='/img/derivatives/simple/9616/thumbnail.jpg' /></a>,3507|3508|3509|9616,Woodland Road near a Village,Painting,"Village, Town and Cityscape",Traveling Cattle Horse Swine Forest Stream Burghers Peasants Road Wagon,1610,37,58,,,Panel,,BRUEGHEL 1610,,,,,,,,,,,,Jan Brueghel the Elder,"Ertz 2008-10, #53, Ertz 1979, #222, Honig database",222,53,,,Private,,,,Marietta Vok,6512|6513|6514|6515|6516,"Ertz 1979, cat. #222 ; Ertz 2008-10, cat. #53",,3507|3508|3509|9616,,,,542,brueghel_item,brueghel,img/derivatives/simple/3785/thumbnail.jpg,img/derivatives/simple/3785/full.jpg
3626,<table><tr><td>1987</td><td>France Paris</td><td>Galerie d'Art St. Honoré</td></tr></table>,,,The Golden Age,Painting,Allegory,Animals Rubens Forest Nude Putti Landscape,ca. 1600,46.7,71.8,,,Panel,,,,,,Peter Paul Rubens (1577-1632),,,,,,,,Produced Outside Jan Brueghel's Studio,"Ertz 2008-10, #544",,544,,,Private,,,,"France, Private Collection",6140,"Ertz 2008-10, Cat. 544, pp. 1172-77",,,,,,444,brueghel_item,brueghel,img/derivatives/simple/3626/thumbnail.jpg,img/derivatives/simple/3626/full.jpg
3418,<table><tr><td>By 1740</td><td></td><td>Bagnall Collection</td></tr><tr><td>1750</td><td>Wales</td><td>Acquired by Frederick Prince of Wales</td></tr></table>,<a href='/brughel/3426'><img src='/img/derivatives/simple/3426/thumbnail.jpg' /></a>|<a href='/brughel/3422'><img src='/img/derivatives/simple/3422/thumbnail.jpg' /></a>,3426|3422,"Paradise Landscape with Fall of Man (London, Hampton Court)",Painting,Religious,Harvesting Cattle Deer Horse Monkey Parrot Forest Nude Old_Testament Paradise,1615,47.6,66,,,Copper,,BRUEGHEL 1615,,,,,,,,,,,,Produced in Jan Brueghel's Studio,"Ertz 2008-10, #192, Honig database as uncertain, possibly studio",,192,,,Public,England,Surrey,"Hampton Court Palace, Royal Collection",the Royal Collection,5698|5699,"Ertz 1979, p. 245, fig. 316; Ertz 1984, cat. #96 as Jan the Younger; Faber Kolb 2005, p. 78; White 2007, cat. #10; Brussels 2008, pp. 122-125; Ertz 2008-10, cat. #192","Still Life, Norwich Castle Museum, 1955, cat. #5|Brussels 2008, cat. #19",3426|3422,,,,292,brueghel_item,brueghel,img/derivatives/simple/3418/thumbnail.jpg,img/derivatives/simple/3418/full.jpg
9653,<table><tr><td></td><td>England Chatsworth</td><td>Dukes of Devonshire</td></tr></table>,,,"Rome: View of the Forum, with Columns of the Temple of Castor and Pollux",Drawing,Ruins,Ruins Temple,1599,20.8,22.7,,,Paper,Pen and brown ink,,,,"""Augustus 28 1599""",,,,,,,,,,Bailey/Walker cat. #CHAT.DV.6,,,CHAT.DV.6,,Public,England,Chatsworth,Devonshire Collection,1157,6686,"Pérac 1916, p. 100 (&quot;a similar view by Jan Brueghel&quot;); Jaffé 2002, vol. 2, p. 180, nr. 1169",,,,,,627,brueghel_item,brueghel,img/derivatives/simple/9653/thumbnail.jpg,img/derivatives/simple/9653/full.jpg
18635,<table><tr><td></td><td></td><td>Previously acquired by Baron Coppée in 1939 from Sam Hartveld of Antwerp.</td></tr></table>,,,A Kunstkammer with Venus,,,,1601-1678,59.6,89.9,,,,,,,,,,,,,,,,,,,,,,,,,,,"Sold at Sothebys London Old Masters Sale on July 09, 2014 for 158,500 GBP.",9833,,,,,,,162,brueghel_item,brueghel,img/derivatives/simple/18635/thumbnail.jpg,img/derivatives/simple/18635/full.jpg
3356,<table><tr><td>Before 1937</td><td>Germany Munich</td><td>Alte Pinakothek inv. #1882</td></tr><tr><td>1937</td><td>Germany Munich</td><td>Sale to Gallery Böhler</td></tr></table>,<a href='/brughel/3117'><img src='/img/derivatives/simple/3117/thumbnail.jpg' /></a>,3117,Market Day in Village by a River,Painting,"Village, Town and Cityscape",Market Dog Fish Horse House Windmill Landing_stage River Burghers Boat Wagon,1611,41,61,,,Panel,,BRUEGHEL 1611,,,,,,,,,,,,Jan Brueghel the Elder,"Ertz 2008-10, #131, Ertz 1979, #235, Honig database",235,131,,,Public,Germany,Bonn,Rheinisches Landesmuseum,inv. #1959,5558|5559,"Ertz 1979, cat. #235, fig. 25; Ertz 2008-10, cat. #131; Prosperettii 2009, pp. 12; Currie & Allart 2012, pp. 133","Vlaamse Kunst, Bruges, 1956, #57.",3117,,,,237,brueghel_item,brueghel,img/derivatives/simple/3356/thumbnail.jpg,img/derivatives/simple/3356/full.jpg
3342,<table><tr><td>1601</td><td>Italy Rome</td><td>Possibly Collection of Benedetto Giustiniani</td></tr><tr><td>Mar 24 1953</td><td>France Paris</td><td>Charpentier Lot #7</td></tr><tr><td>1961</td><td>Netherlands Amsterdam</td><td>Gallery de Boer</td></tr></table>,<a href='/brughel/3343'><img src='/img/derivatives/simple/3343/thumbnail.jpg' /></a>|<a href='/brughel/3628'><img src='/img/derivatives/simple/3628/thumbnail.jpg' /></a>,3343|3628,Last Judgement,Painting,Religious,Preaching Angels Heaven New_Testament,1601,26.5,36,,,Copper,,BRUEGHEL 1601,,,,,,,,,,,,Jan Brueghel the Elder,"Ertz 2008-10, #322, Ertz 1979, #81, Honig database",81,322,,,Private,,,,Unknown,5527|5528|5529,"Ertz 1979, cat. #81, fig. 129; Ertz 2008-10, cat. #322",,3343|3628,,,,226,brueghel_item,brueghel,img/derivatives/simple/3342/thumbnail.jpg,img/derivatives/simple/3342/full.jpg
3424,<table><tr><td>Before 1920</td><td>Austria Vienna</td><td>Private Collection</td></tr><tr><td>ca. 1920</td><td>Switzerland</td><td>Private Collection</td></tr><tr><td>1979</td><td>England London</td><td>Thomas Brod Gallery</td></tr><tr><td>1992</td><td>United States Los Angeles CA</td><td>J. Paul Getty Museum</td></tr></table>,<a href='/brughel/3423'><img src='/img/derivatives/simple/3423/thumbnail.jpg' /></a>|<a href='/brughel/3094'><img src='/img/derivatives/simple/3094/thumbnail.jpg' /></a>|<a href='/brughel/9646'><img src='/img/derivatives/simple/9646/thumbnail.jpg' /></a>,3423|3094|9646,"Paradise Landscape with Noah&apos;s Ark (Los Angeles, J. Paul Getty Museum)",Painting,Religious,Traveling Cattle Deer Monkey Parrot Forest Burghers Old_Testament Paradise,1613,54.5,87,,,Panel,,BRUEGHEL FEC 1613,,,,,,,,,,,,Jan Brueghel the Elder,"Ertz 2008-10, #197, Ertz 1979, #273, Honig database",273,197,,,Public,United States,"Los Angeles, CA",J. Paul Getty Museum,inv. #92.PB.82,5709|5710|5711|5712,"Ertz 1979, cat. #273; Faber Kolb, 2005; Silver 2006, pp. 213-14, fig. 10.5; Ertz 2008-10, cat. #197","London 1979, cat. #29|Los Angeles 1999-2000|Los Angeles-The Hague 2006, cat. #26",3423|3094|9646,,,http://www.getty.edu/art/gettyguide/artObjectDetails?artobj=1034,299,brueghel_item,brueghel,img/derivatives/simple/3424/thumbnail.jpg,img/derivatives/simple/3424/full.jpg
3395,<table><tr><td>1932</td><td>Austria Vienna</td><td>Bequeathed by Gustav von Benda to Kunsthistorisches Museum</td></tr></table>,,,"Oil Sketch of Monkeys, Donkeys, and Cats",Oil Sketch,Study,Dog Monkey,ca. 1613,34.2,55.5,,,Panel,,,,,,,,,,,,,,Jan Brueghel the Elder,"Ertz 2008-10, #583, Ertz 1979, #311, Honig database",311,583,,,Public,Austria,Vienna,Kunsthistorisches Museum,inv. #6988,5631,"Gluck 1912, pp. 222, 230; Ertz 1979, cat. #311; Faber Kolb 2005, pp. 11-13; Ertz 2008-10, pg. 1262, cat. 583","Essen/Vienna 1997, cat. #200|Antwerp 1998, cat. #92|Los Angeles/The Hague 2006, cat. #28, pp. 202-207",,,,http://bilddatenbank.khm.at/viewArtefact?id=337,273,brueghel_item,brueghel,img/derivatives/simple/3395/thumbnail.jpg,img/derivatives/simple/3395/full.jpg
3381,<table><tr><td></td><td>United States New Haven CT</td><td>Egmont Collection Yale Library Transfer</td></tr></table>,,,Mountainous Landscape with View over a Valley,Drawing,Landscape,Birds,,19.5,30.2,,,Paper,"Pen and brown ink, brown and blue wash, over preliminary drawing in black chalk",,,,"""P. Brill"" and ""1613""",,,,,,,,,,Bailey/Walker cat. #NEWH.YU.26,,,NEWH.YU.26,,Public,United States,"New Haven, CT",Yale University Art Gallery,1961.62.56,6933,"New Haven 1970, p. 291, nr. 534, pl. 283",,,,,http://artgallery.yale.edu/collections/objects/58615,261,brueghel_item,brueghel,img/derivatives/simple/3381/thumbnail.jpg,img/derivatives/simple/3381/full.jpg
3380,<table><tr><td></td><td>United States New Haven CT</td><td>Egmont Collection Yale Library Transfer</td></tr></table>,,,Mountainous Landscape with Two Figures at Left,Drawing,Landscape,,,21,20.8,,,Paper,"Pen and brown ink, brush and blue and brown ink, blue and brown wash",,,,"""P. Brill""; ""21 descember 1609""; ""Paul Brill""",,,,,,,,,,Bailey/Walker cat. #NEWH.YU.25,,,NEWH.YU.25,,Public,United States,"New Haven, CT",Yale University Art Gallery,1961.62.55,6932,"New Haven 1970, p. 290, nr. 533",,,,,http://artgallery.yale.edu/collections/objects/58613,260,brueghel_item,brueghel,img/derivatives/simple/3380/thumbnail.jpg,img/derivatives/simple/3380/full.jpg
2920,<table><tr><td>1990</td><td>Netherlands Amsterdam</td><td>Gallery Roelofsz</td></tr></table>,<a href='/brughel/2930'><img src='/img/derivatives/simple/2930/thumbnail.jpg' /></a>,2930,Allegory of Gambling: Monkeys Playing a Board Game,Painting,Allegory,Games Monkey Fruit,ca. 1620,7,9.2,,,Copper,,,,,,,,,,,,,,Produced in Jan Brueghel's Studio,"Ertz 2008-10, #546",,546,,,Private,,,,"Netherlands, Private Collection",4563,"Ertz 2008-10, cat. #546, p. 1180",,2930,,,,216,brueghel_item,brueghel,img/derivatives/simple/2920/thumbnail.jpg,img/derivatives/simple/2920/full.jpg
2934,,<a href='/brughel/3798'><img src='/img/derivatives/simple/3798/thumbnail.jpg' /></a>|<a href='/brughel/2932'><img src='/img/derivatives/simple/2932/thumbnail.jpg' /></a>|<a href='/brughel/2937'><img src='/img/derivatives/simple/2937/thumbnail.jpg' /></a>|<a href='/brughel/2936'><img src='/img/derivatives/simple/2936/thumbnail.jpg' /></a>|<a href='/brughel/3797'><img src='/img/derivatives/simple/3797/thumbnail.jpg' /></a>,3798|2932|2937|2936|3797,Allegory of Water (London),Painting,Allegory,Cosmology Animals Birds Fish Van_Balen Nude Putti Landscape,,47,66,,,Copper,,,,,,Hendrick van Balen (1575-1632),?,,,,,,,Produced in Jan Brueghel's Studio,"Ertz 2008-10, #500",,500,,,Private,,,,"London, Christie's, June 26, 1970, inv. #50",,,,3798|2932|2937|2936|3797,,,,323,brueghel_item,brueghel,img/derivatives/simple/2934/thumbnail.jpg,img/derivatives/simple/2934/full.jpg
3394,<table><tr><td>1932</td><td>Austria Vienna</td><td>Bequethed by Gustav von Benda to Kunsthistorisches Museum</td></tr></table>,,,Oil Sketch of Dogs,Oil Sketch,Study,Dog Swine,ca. 1613-ca. 1616,34.4,55.5,,,Panel,,,,,,,,,,,,,,Jan Brueghel the Elder,"Ertz 2008-10, #582, Ertz 1979, #312, Honig database",312,582,,,Public,Austria,Vienna,Kunsthistorisches Museum,inv. #6985,5630,"Gluck 1912, pp. 222, 230; Ertz 1979, cat. #312; Faber Kolb 2005, pp. 11-13; Ertz 2008-10, pg. 1262, cat. 582","Essen/Vienna 1997, cat. #93|Antwerp 1998, cat. #92|Los Angeles/The Hague 2006, cat. #27|Munich 2013, cat. #79",,,7321,http://bilddatenbank.khm.at/viewArtefact?id=336,272,brueghel_item,brueghel,img/derivatives/simple/3394/thumbnail.jpg,img/derivatives/simple/3394/full.jpg
9691,<table><tr><td>18th century to 19th century</td><td>England London</td><td>Thomas Dimsdale (Lugt 2426)</td></tr><tr><td>1834</td><td>England London</td><td>William Esdaile (Lugt 2617</td></tr></table>,,,Skaters on a Frozen Canal,Drawing,"Urban, Common and Peasant Life",,,18.7,27.1,,,Paper,"Pen with bistre, washed",,,,"Collector's marks: (Verso, LL) Th. Dimsdale, (LR) William Eisdaile",,,,,,,,,,Bailey/Walker cat. #HAMB.KH.3,,,HAMB.KH.3,,Public,Germany,Hamburg,Hamburger Kunsthalle (Kupferstichkabinett),21755,6750|6751,"Hamburg 1920, p. 9, nr. 21","Hamburg 1920, nr. 21",,,7300,,013,brueghel_item,brueghel,img/derivatives/simple/9691/thumbnail.jpg,img/derivatives/simple/9691/full.jpg
3425,"<table><tr><td>1654</td><td>Italy Rome</td><td>Documented in possession of Camillo Pamphili (Roma Archivo Doria Pamphili 91 81 letter of 2 March 1654.; reprinted Garms 1972)</td></tr><tr><td>1819</td><td></td><td>Fidecommissario Catalogue (as ""Brueghel"")</td></tr></table>",<a href='/brughel/3420'><img src='/img/derivatives/simple/3420/thumbnail.jpg' /></a>|<a href='/brughel/3841'><img src='/img/derivatives/simple/3841/thumbnail.jpg' /></a>|<a href='/brughel/3421'><img src='/img/derivatives/simple/3421/thumbnail.jpg' /></a>,3420|3841|3421,"Paradise Landscape with the Fall of Man (Rome, Galleria Doria-Pamphili)",Painting,Religious,Harvesting Cattle Deer Horse Monkey Parrot Forest Nude Old_Testament Paradise,1612,50,80,,,Copper,,BRUEGHEL 16(1)2,,,,,,,,,,,,Jan Brueghel the Elder,"Ertz 2008-10, #188, Ertz 1979, #291, Honig database",291,188,,,Public,Italy,Rome,Galleria Doria Pamphilj,inv. #FC341,5713|5714,"Garms, 1972; Ertz 1979, cat. #291, fig. 314; Genoa 1996; Ertz, 2008-10, cat. #188",Genoa 1996,3420|3841|3421,,,,300,brueghel_item,brueghel,img/derivatives/simple/3425/thumbnail.jpg,img/derivatives/simple/3425/full.jpg
3431,<table><tr><td>Before 1979</td><td>Sweden Stockholm</td><td>Collection of Osborn Kling</td></tr><tr><td>19th century to 20th century</td><td>Sweden Stockholm</td><td>Collection of Einar Perman</td></tr><tr><td></td><td>Germany Dortmund</td><td>Collection of H. Becker</td></tr></table>,,,"Peasant Dance on Hilltop Road, with Burgher Audience",Painting,Landscape,Dancing Horse Forest Valley Burghers Road Wagon,1614,9.5,15,,,Copper,,BRUEGHEL 1614,,,,,,,,,,,,Jan Brueghel the Elder,"Ertz 2008-10, #46, Ertz 1979, #282, Honig database",282,46,,,Private,,,,"Paris, Galerie de Jonkheere, 1997",5732|5733|5734,"Ertz 1979, cat. #282, fig. 46; Ertz 2008-10, cat. #46","1963 - Singer Museum, Laren, #41",,,,,304,brueghel_item,brueghel,img/derivatives/simple/3431/thumbnail.jpg,img/derivatives/simple/3431/full.jpg
18634,"<table><tr><td></td><td></td><td>Sold at Dorotheum in Vienna on April 19 2016 estimated 80,000 - 120,000 EUR [Lot 00067].</td></tr></table>",,,The Temptation of Saint Anthony (Belgium),Painting,Religious,,,14,23.6,,,,,,,,,,,,,,,,,,,,,,,Private,,,,,9832,,,,,,,161,brueghel_item,brueghel,img/derivatives/simple/18634/thumbnail.jpg,img/derivatives/simple/18634/full.jpg
3357,<table><tr><td>1659</td><td>Belgium Brussels</td><td>Possibly Royal Palace</td></tr><tr><td>1700</td><td>Spain</td><td>Zarzuela</td></tr><tr><td>1772</td><td>Spain Madrid</td><td>Palacio Nuevo quarters of the Infanta</td></tr><tr><td>1794</td><td>Spain Madrid</td><td>Palacio Nuevo dressing room of the Queen</td></tr><tr><td>1849</td><td>Spain Madrid</td><td>Prado Museum</td></tr></table>,,,Market and Bleaching Ground,Painting,Staffage in Landscape,Bleaching Market Birds Dog Horse Swine Village Momper Pond Stream Valley Burghers Peasants Labor Cart,1620-1623,166,194,,,Canvas,,,,,,Joos de Momper (1564-1635),,,,,,,,Jan Brueghel the Elder,"Ertz 2008-10, #718, Ertz 1979, #423, Honig database",423,718,,,Public,Spain,Madrid,Museo del Prado,inv. #1443,5560|5561|5562|5563|5564,"Winkelmann-Rhein 1968, p. 54; Díaz Padrón  & Recchiuto 1973, p. 103; Madrid 1975, p. 198; Brussels 1975, p. 126; Ertz 1979, cat. #423; Ertz 1986, cat. #375; Sutton 1993, p. 474-476 cat. #87; Madrid 1995, p. 254; Honig 1998, p. 124; Ertz 2008-10, cat. #718","Brussels 1975, cat. #27|Brussels 1985, cat. #D30|Boston 1993, cat. #87|Santiago de Compostela 2011, cat. #20",,,,https://www.museodelprado.es/coleccion/obra-de-arte/mercado-y-lavadero-en-flandes/9d52f6ed-1203-46b0-91b8-4436ce965d03,238,brueghel_item,brueghel,img/derivatives/simple/3357/thumbnail.jpg,img/derivatives/simple/3357/full.jpg
3419,<table><tr><td>1746</td><td>Spain Madrid</td><td>Possibly La Granja</td></tr></table>,,,Paradise Landscape with Fall of Man (Madrid),Painting,Religious,Harvesting Cattle Deer Horse Parrot De_Clerck Forest Nude Old_Testament Paradise,ca. 1608,40,50,,,Copper,,,,,,Hendrick de Clerck (1570-1629/30),,,,,,,,Produced Outside Jan Brueghel's Studio,"Ertz 2008-10, #187, Ertz 1984 as Jan the Younger, De Clerck, and Van Alsloot, Díaz Padrón 1975 as Jan the Younger",,187,,,Public,Spain,Madrid,Museo del Prado,inv. #1408,5700,"Ertz 1984, cat. #86 as Jan the Younger; Ertz 2008-10, cat. #187","Santiago de Compostela 2011, cat. #10",,,,https://www.museodelprado.es/coleccion/obra-de-arte/adan-y-eva-en-el-paraiso/af4dff4e-be12-4aac-92b5-f3c9ba6f034c,293,brueghel_item,brueghel,img/derivatives/simple/3419/thumbnail.jpg,img/derivatives/simple/3419/full.jpg
9646,<table><tr><td></td><td>United States St. Louis MO</td><td>Private Collection</td></tr><tr><td>Jan 20 1982</td><td>United States New York NY</td><td>Sale Sotehby's (Parke-Bernet) Lot #53</td></tr><tr><td></td><td>Canada Brampton</td><td>Bought by Vermeer Associates Ltd.</td></tr><tr><td></td><td></td><td>Long-term loan to Fogg Art Museum</td></tr><tr><td>2003</td><td>United States Cambridge MA</td><td>Sale to Harvard University Art Museums</td></tr></table>,<a href='/brughel/3424'><img src='/img/derivatives/simple/3424/thumbnail.jpg' /></a>|<a href='/brughel/2976'><img src='/img/derivatives/simple/2976/thumbnail.jpg' /></a>,3424|2976,Two Studies of an Ostrich,Drawing,Study,Birds,,20.4,14.1,,,Paper,"Blue, green, pink and brown washes and brown ink on cream antique laid paper, framing line in brown ink",,,,"Center of body: ""soyt [? or sbyl?]""; Top of thigh: ""d'be[en?] d'le""; Mount, verso, UR: ""J Bell""; Verso, ""Sp. 27. A [? or 5/o. 27. A]""; left-hand head: ""brungrau. ...""; left neck: ""licht grau ...""; UR: ""9 voeten hooghe""",,,,,,,,,,Bailey/Walker cat. #CAMB.FG.6,,,CAMB.FG.6,,Public,United States,"Cambridge, MA","Fogg Museum, Harvard University",2003.156,6652|6653|6654|6655|6656,"Los Angeles/The Hague 2006-07, p. 197, nr. 26, fig. 102 (as Jan Brueghel the Elder)","Los Angeles/The Hague 2006-07, under nr. 26",3424|2976,,7330,http://www.harvardartmuseums.org/collections/object/312359?position=0,624,brueghel_item,brueghel,img/derivatives/simple/9646/thumbnail.jpg,img/derivatives/simple/9646/full.jpg
3627,<table><tr><td></td><td>Germany Mannheim</td><td>From the Galerie Mannheim</td></tr></table>,<a href='/brughel/3487'><img src='/img/derivatives/simple/3487/thumbnail.jpg' /></a>|<a href='/brughel/3528'><img src='/img/derivatives/simple/3528/thumbnail.jpg' /></a>|<a href='/brughel/3048'><img src='/img/derivatives/simple/3048/thumbnail.jpg' /></a>,3487|3528|3048,The Harvest: Allegory of Summer,Painting,Allegory,Harvesting Seasons Summer Roundel Field River,ca. 1596,,,12.4,,Copper,,,,,,,,,,,,,,Jan Brueghel the Elder,"Ertz 2008-10, #526, Ertz 1979, #6, Honig database",6,526,,,Public,Germany,Munich,Alte Pinakothek,inv. #4911,6141,"Ertz 1979, cat. #6, p. 104; Ertz 2008-10, cat. #526",,3487|3528|3048,,,,445,brueghel_item,brueghel,img/derivatives/simple/3627/thumbnail.jpg,img/derivatives/simple/3627/full.jpg
3790,"<table><tr><td>1627</td><td>Italy Rome</td><td>Collection of Francesco Maria del Monte</td></tr><tr><td>1944</td><td>England London</td><td>Asa Thomas Auction</td></tr><tr><td>Mar 17 1944</td><td>England London</td><td>Sale Christie's Lot #11</td></tr><tr><td>1947</td><td>United States New York NY</td><td>Collection of Salomon Bergs</td></tr><tr><td>Before 1960</td><td>England London</td><td>Beaufort Collection</td></tr><tr><td>Dec 7 1960</td><td>Belgium Brussels</td><td>Sale Stuyck Auction #18 (as ""Jan I and Rottenhammer"")</td></tr><tr><td>1969</td><td>United States New York NY</td><td>Collection of Salomon Bergs</td></tr><tr><td>Dec 12 1979</td><td>England London</td><td>Sale Sotheby's Lot #21</td></tr><tr><td>1986</td><td>Canada Toronto</td><td>Art Gallery of Ontario gift from Joey and Toby Tanenbaum</td></tr></table>",,,Allegory: The Dream of Raphael (Circe & Ulysses),Painting,Allegory,Rottenhammer Putti Allegory Classical Landscape Mythological,1595,35,51,,,Copper,,BRUEGHEL 1595,,,,Hans Rottenhammer (1564-1625),,Francesco Maria del Monte 1549-1627,,,,,,Jan Brueghel the Elder,"Ertz 2008-10, #347, Ertz 1979, #15, Honig database",15,347,,,Public,Canada,Toronto,Art Gallery of Ontario,inv. #86/238,4485|4486|4487|4488|4489|4490|4491|4492|4493,"Ertz 1979, cat. #15, fig. 116, p. 90, 114, 504; Ferino-Pagden in Essen 1997, cat. #76, 260-262; Ertz 2008-10, cat. #347; Brown in Borggrefe 2008",,,,,,546,brueghel_item,brueghel,img/derivatives/simple/3790/thumbnail.jpg,img/derivatives/simple/3790/full.jpg
