pid,provenance_html,related_html,related_ids,label,object_type,genre,tags,realdate,height_cm,width_cm,diameter_cm,plate_dimensions,support,drawing_medium,signature,signature_location,support_marks,further_inscription,collaborators,collaborator_notes,collectors_patrons,print_type,print_notes,printmaker,publisher,states,our_attribution,other_attribution_authorities,ertz_1979,ertz_2008,bailey_walker,hollstein_no,collection_type,location_country,location_city,location_collection,location_or_most_recent_sale_notes,provenance,bibliography,exhibition_history,related_works,copies_and_variants,curatorial_files,external_resources,order,layout,collection,thumbnail,full
3681,<table><tr><td>Jan 26 2005</td><td>United States New York NY</td><td>Sale Christie's Lot #212</td></tr></table>,,,Venus and Adonis in a Forest Landscape,Painting,Classical Mythology,Basket Forest Nude Putti Classical Mythological Flowers Fruit,ca. 1600,29.8,38.3,,,Copper,,,,,,,,,,,,,,Produced Outside Jan Brueghel's Studio,"Ertz 2008-10, Add. 22, Honig database",,,,,Private,,,,"Belgium, Private Collection, 2010",6275,"Ertz 2008-10, cat. Add. 22",,,,,,475,brueghel_item,brueghel,img/derivatives/simple/3681/thumbnail.jpg,img/derivatives/simple/3681/full.jpg
3093,<table><tr><td>1922</td><td>England</td><td>Collection of Baroness Burdett-Coutts</td></tr><tr><td>Until 1955</td><td>England London</td><td>Collection of Viscountess Bertie of Thame</td></tr><tr><td>Purchased at Slatter Gallery in 1955</td><td>Portugal Lisbon</td><td>Casa-Museu Medeiros e Almeida</td></tr></table>,<a href='/brughel/3090'><img src='/img/derivatives/simple/3090/thumbnail.jpg' /></a>|<a href='/brughel/3091'><img src='/img/derivatives/simple/3091/thumbnail.jpg' /></a>|<a href='/brughel/3092'><img src='/img/derivatives/simple/3092/thumbnail.jpg' /></a>,3090|3091|3092,Entrance to a Village with a Windmill,Painting,"Village, Town and Cityscape",Animals Village Windmill Burghers Peasants Cart Road,1606,19,22.8,,,Copper,,Brueghel 1606,,,,,,,,,,,,Jan Brueghel the Elder,"Ertz 1979, #115, Honig database as uncertain, possibly studio",115,,,,Private,,,,"London, Slatter Gallery, 1955",4997|10415|4998,"Ertz 1979, cat. #115",,3090|3091|3092,,,,170,brueghel_item,brueghel,img/derivatives/simple/3093/thumbnail.jpg,img/derivatives/simple/3093/full.jpg
9569,,,,Rest on the Flight into Egypt,Print,Religious,Resting Traveling Coast Harbor Mountain Waterfall Christ Holy_family New_Testament Saint Virgin_Mary,1596,20.5,27.5,,,,,,,,Joan Breugel invent. EG Sadeler sculp.,,,,Engraving,,Aegidius Sadeler,,2,,Hollstein No. Sadeler 209,,,,Sadeler 209,Public,Germany,Berlin,"Kupferstichkabinett, Staatliche Museen zu Berlin",,,Ertz 483; Hollstein 43xxi,,,,,http://www.metmuseum.org/collection/the-collection-online/search/382731,601,brueghel_item,brueghel,img/derivatives/simple/9569/thumbnail.jpg,img/derivatives/simple/9569/full.jpg
3044,"<table><tr><td></td><td>Belgium Brussels</td><td>Simon de Monte (1878-1930)</td></tr><tr><td>Dec 21 1925</td><td>Belgium Brussels</td><td>Sale Fiévez</td></tr><tr><td>May 29 1986</td><td>Netherlands Amsterdam</td><td>Sale Christie's Lot #167 (as ""follower of Jan I"")</td></tr><tr><td>Dec 12 2002</td><td>England London</td><td>Sale Sotheby's Lot #27 (as ""studio of Jan Brueghel the Elder"")</td></tr></table>",<a href='/brughel/3043'><img src='/img/derivatives/simple/3043/thumbnail.jpg' /></a>|<a href='/brughel/3042'><img src='/img/derivatives/simple/3042/thumbnail.jpg' /></a>,3043|3042,Coastal Landscape with Temple of Vesta (London),Painting,Landscape,Fish Temple Coast Landing_stage Fishermen Boat,1600,18.3,25.7,,,Copper,,BRUEGHEL,,,,,,,,,,,,Produced in Jan Brueghel's Studio,"Ertz 2008-10, #115",,115,,,Private,,,,"London, Richard Green Gallery",4870|4871|4872|4873,"Ertz 2008-10, cat. #115",,3043|3042,,,,137,brueghel_item,brueghel,img/derivatives/simple/3044/thumbnail.jpg,img/derivatives/simple/3044/full.jpg
3050,<table><tr><td>Before 1806</td><td>Germany Munich</td><td>Ducai Gallery</td></tr></table>,<a href='/brughel/3669'><img src='/img/derivatives/simple/3669/thumbnail.jpg' /></a>,3669,"Country Road with Elegant Travelers, Including Nursing Mother",Painting,Landscape,Traveling Dog Horse Swine Forest Burghers Children Road Wagon,1619,26.8,37,,,Copper,,BRUEGHEL 1619,,,,,,,,,,,,Jan Brueghel the Elder,"Ertz 2008-10, #25, Ertz 1979, #347, Honig database",347,25,,,Public,Germany,Munich,Alte Pinakothek,inv. #1877,4883,"Ertz 1979, cat. #347, pp. 62, 615, fig. 21; Renger/Denk 2002, p. 112; Ertz 2008-10, cat. #25, p. 114","Munich 2013, #77",3669,,,,142,brueghel_item,brueghel,img/derivatives/simple/3050/thumbnail.jpg,img/derivatives/simple/3050/full.jpg
3736,,<a href='/brughel/3871'><img src='/img/derivatives/simple/3871/thumbnail.jpg' /></a>,3871,Village at End of a Canal,Painting,"Village, Town and Cityscape",Animals Village Canal Burghers Peasants Cart,ca. 1607,21,32,,,Copper,,BRUEGHEL 16(0)7,,,,,,,,,,,,Produced in Jan Brueghel's Studio,"Ertz 2008-10, #180, Ertz 1979, #153, Honig database",153,180,,,Public,Italy,Milan,Pinacoteca di Brera,,,"Ertz 1979, cat. #153, fig. 265; Ertz 2008-10, cat. #180",,3871,,,,519,brueghel_item,brueghel,img/derivatives/simple/3736/thumbnail.jpg,img/derivatives/simple/3736/full.jpg
9794,,,,Seventeen Studies of Different Dogs,Drawing,Study,Dog,,22.8,34.2,,,Paper,,,,,,,,,,,,,,,Bailey/Walker cat. #PARI.ML.25,,,PARI.ML.25,,Public,France,Paris,Musée du Louvre,INV 19378,,"Paris 1838, nr. 722; Lugt 1949, nr. 17; Paris 1977-78, nr. 336, ill.","Paris 1977-78, nr. 336|Paris 1982-83",,,,http://arts-graphiques.louvre.fr/detail/oeuvres/1/109498-Dix-sept-etudes-de-differents-chiens,053,brueghel_item,brueghel,img/derivatives/simple/9794/thumbnail.jpg,img/derivatives/simple/9794/full.jpg
3285,<table><tr><td>1633</td><td>Spain San Juan</td><td>One of 25 paintings sent from Flanders for the Queen at the Torre Nueva Alcazar</td></tr><tr><td>1633</td><td>Spain San Juan</td><td>In Great Chamber near to Lower Court</td></tr><tr><td>1701</td><td>Spain Madrid</td><td>Casa de Campo</td></tr></table>,<a href='/brughel/3286'><img src='/img/derivatives/simple/3286/thumbnail.jpg' /></a>|<a href='/brughel/3832'><img src='/img/derivatives/simple/3832/thumbnail.jpg' /></a>,3286|3832,Infanta Isabella and her Entourage in the Park at Mariemont,Painting,Landscape,Harvesting Animals Deer Dog Pendant Mariemont Nobles,ca. 1620,175,236,,,Canvas,,,,,,,,,,,,,,Jan Brueghel the Elder,"Ertz 2008-10, #563, Honig database, Madrid 1995 & 1975 as Jan I and Joos de Momper, Ertz 1984, cat #83, as Jan the Younger",,563,,,Public,Spain,Madrid,Museo del Prado,inv. #1429,5417|5418|5419,"Wurzbach 1906, vol. 1, p. 205; Beroqui 1917, p. 129; Llanos y Torriglia 1925, p. 49; Terlinden 1934, p. 217; Winner 1972, p. 155, n. 62, fig. 35; Madrid 1975, p. 202; Madrid 1995, p. 249; Ertz 2008-10, cat. #563, pp. 1220-21","Hamm/Mainz 2000, cat. #28|Santiago de Compostela 2011, cat. #29",3286|3832,,,https://www.museodelprado.es/coleccion/obra-de-arte/la-infanta-isabel-clara-eugenia-en-el-parque-de/d5356756-fa1f-47c9-86c2-be50ae21ce09,206,brueghel_item,brueghel,img/derivatives/simple/3285/thumbnail.jpg,img/derivatives/simple/3285/full.jpg
9757,<table><tr><td>1967</td><td></td><td>Richard Hodgkin (Dealer)</td></tr><tr><td>1969</td><td>Canada Ottawa</td><td>Purchased by National Gallery of Canada</td></tr></table>,,,Village Landscape,Drawing,"Village, Town and Cityscape",,1625,12.6,17.5,,,Paper,Pen and brown ink with green-blue wash,,,,Breugel,,,,,,,,,Jan Brueghel the Elder,Bailey/Walker cat. #OTTA.NG.3,,,OTTA.NG.3,,Public,Canada,Ottawa,National Gallery of Canada,15789r,7008|7009,"London 1967-68, nr. 24","London 1967-68, nr. 24",,,,http://www.gallery.ca/en/see/collections/artwork.php?mkey=7806,038,brueghel_item,brueghel,img/derivatives/simple/9757/thumbnail.jpg,img/derivatives/simple/9757/full.jpg
3508,<table><tr><td></td><td>Spain Madrid</td><td>Royal Collection</td></tr><tr><td>Jun 1813</td><td>Spain Vitoria</td><td>Taken at the Battle of Vitoria</td></tr></table>,<a href='/brughel/3785'><img src='/img/derivatives/simple/3785/thumbnail.jpg' /></a>|<a href='/brughel/3507'><img src='/img/derivatives/simple/3507/thumbnail.jpg' /></a>|<a href='/brughel/3509'><img src='/img/derivatives/simple/3509/thumbnail.jpg' /></a>|<a href='/brughel/9616'><img src='/img/derivatives/simple/9616/thumbnail.jpg' /></a>,3785|3507|3509|9616,Road through a Woodland Village (London),Painting,"Village, Town and Cityscape",Traveling Cattle Horse Stream Burghers Road Wagon,ca. 1611,23,36,,,Panel,,,,,,,,,,,,,,Produced in Jan Brueghel's Studio,"Ertz 2008-10, #55, Ertz 1979, #241, Honig database as Jan and studio",241,55,,,Public,England,London,"Wellington Museum, Apsley House",inv. #1639-1948,5907|5908,"Ertz 1979, cat. #241, fig. 167; Ertz 2008-10, cat. #55",,3785|3507|3509|9616,,,,368,brueghel_item,brueghel,img/derivatives/simple/3508/thumbnail.jpg,img/derivatives/simple/3508/full.jpg
3246,<table><tr><td></td><td>Germany Munich</td><td>Kurfürstlichen Galerie</td></tr><tr><td>1922</td><td>Germany Munich</td><td>Alte Pinakothek Catalogue of 1922 inv. #149</td></tr><tr><td>After 1930</td><td>Germany Munich</td><td>Schleißheim Painting Gallery</td></tr><tr><td></td><td>Germany Munich</td><td>Bavarian State Painting Gallery Collection inv. #149</td></tr></table>,<a href='/brughel/3240'><img src='/img/derivatives/simple/3240/thumbnail.jpg' /></a>|<a href='/brughel/3241'><img src='/img/derivatives/simple/3241/thumbnail.jpg' /></a>|<a href='/brughel/3126'><img src='/img/derivatives/simple/3126/thumbnail.jpg' /></a>|<a href='/brughel/3239'><img src='/img/derivatives/simple/3239/thumbnail.jpg' /></a>,3240|3241|3126|3239,Fruit and Flower Garland with the Holy Family in a Landscape (Munich),Painting,Garland,Deer Monkey Parrot Angels Holy_family Flowers Fruit Garland Vegetables,ca. 1623,93.5,70.7,,,Panel,,,,,,Pieter van Avont (1600-1652),,,,,,,,Jan Brueghel the Elder,"Ertz 2008-10, #486, Ertz 1979, #381, Honig database",381,486,,,Public,Germany,Munich,Alte Pinakothek,inv. #149,5340|5341|5342|5343,"Ertz 1979, #381, fig. 392; Renger/Denk 2002, 92-95; Ertz 2008-10, #486","Bloem en Tuin in de Vlaamse Kunst'', Museum Gent, April 1960, cat. #37|Munich 2013, cat. #85",3240|3241|3126|3239,,556|557,,193,brueghel_item,brueghel,img/derivatives/simple/3246/thumbnail.jpg,img/derivatives/simple/3246/full.jpg
3520,<table><tr><td>Dec 6 1932 to Dec 7 1932</td><td>Germany Frankfurt</td><td>Helbing</td></tr><tr><td>1933</td><td>Netherlands Amsterdam</td><td>Gallery Pieter de Boer</td></tr><tr><td>Apr 26 1976 to Apr 27 1976</td><td>Netherlands Amsterdam</td><td>Sale Sotheby's</td></tr><tr><td>Before 1979</td><td>Netherlands Nieuwersluis</td><td>Collection van den Heuvel</td></tr><tr><td></td><td>Denmark Copenhagen Denmark</td><td>Purchased by Statens Museum for Kunst</td></tr></table>,,,Rocky Landscape,Painting,Landscape,Bridge Forest Stream,ca. 1600,,,17,,Panel,,,,,,,,,,,,,,Produced in Jan Brueghel's Studio,"Ertz 2008-10, #90, Ertz 1979, #69, Honig database as uncertain, possibly studio",69,90,,,Public,Denmark,Copenhagen,Statens Museum for Kunst,Sp. 214,5933|5934|5935|5936|7981,"Ertz 1979, cat. #69, no figure number; Ertz 2008-10, cat. #90","B. de Seus van den Heuvel, Arnhem, 1960/1, #8|Singer Museum, Laren, 1963, cat. #47|Roelant Savery, Cologne/ Utrecht, 1985/86, #76",,,,,379,brueghel_item,brueghel,img/derivatives/simple/3520/thumbnail.jpg,img/derivatives/simple/3520/full.jpg
3252,<table><tr><td></td><td>Germany</td><td>Private Collection</td></tr></table>,,,Garden of the Janshoven Castle,Painting,Staffage in Landscape,Birds Cattle Horse Castle Momper Garden Burghers Nobles Peasants Landscape Boat Wagon,,53,66,,,,,,,,,Joos de Momper (1564-1635),,,,,,,,Produced in Jan Brueghel's Studio,"Ertz 2008-10, #736",,736,,,Public,Belgium,Brussels,Hôtel de Ville,,5360,"Ertz 1986, cat. #330; Ertz 2008-10, cat. #736",,,,,,195,brueghel_item,brueghel,img/derivatives/simple/3252/thumbnail.jpg,img/derivatives/simple/3252/full.jpg
3536,<table><tr><td>Mar 3 1800</td><td></td><td>Sale C. Ploos van Amstel</td></tr></table>,,,Sailboats on a Canal,Drawing,Seascape,Birds Windmill Canal Seascape Boat,1603-1605,12.4,20,,,Paper,Pen and ink,,,,,,,,,,,,,Jan Brueghel the Elder,Bailey/Walker cat. #HAAR.TM.1,,,HAAR.TM.1,,Public,Netherlands,Haarlem,Teylers Museum,O 006,6744,"Scholten 1904, p. 61, nr. O 6; London 1970, nr. 9; Essen/Vienna 1997-98, p. 446-7, nr. 156, ill.","London 1970, nr. 9|Essen/Vienna 1997-98, nr. 156",,,,http://www.teylersmuseum.nl/en/collection/drawings/o-006-zeilboten-op-een-vaart-jan-i-breughel-1568-1625-tekenaar,386,brueghel_item,brueghel,img/derivatives/simple/3536/thumbnail.jpg,img/derivatives/simple/3536/full.jpg
9796,<table><tr><td>1935</td><td>France Paris</td><td>Gift of Baron Edmund de Rothschild</td></tr></table>,,,View of a Village at the Edge of a River,Drawing,"Village, Town and Cityscape",,1553-1555,20.2,28.5,,,Paper,Pen and brown ink,,,,,,,,,,,,,,Bailey/Walker cat. #PARI.ML.27,,,PARI.ML.27,,Public,France,Paris,Musée du Louvre,3513 DR,7128,"Madrid/Paris 2004-05, nr. 28, ill.; Paris 2014-15, nr. 21, ill.","Madrid/Paris 2004-05, nr. 28|Paris 2014-15, nr. 21",,,,http://arts-graphiques.louvre.fr/detail/oeuvres/58/537621-Vue-dun-village-au-bord-dune-riviere,055,brueghel_item,brueghel,img/derivatives/simple/9796/thumbnail.jpg,img/derivatives/simple/9796/full.jpg
3720,<table><tr><td></td><td>France Paris</td><td>Musée Napoléon</td></tr></table>,<a href='/brughel/9761'><img src='/img/derivatives/simple/9761/thumbnail.jpg' /></a>,9761,"Village Road, Cruybeke",Drawing,"Village, Town and Cityscape",Cattle Horse Village Cart Road,,15.8,20.2,,,Paper,"Pen and brown ink, brown and indigo wash",,,,Top Center: Cruybeke,,,,,,,,,Jan Brueghel the Elder,Bailey/Walker cat. #PARI.ML.9,,,PARI.ML.9,,Public,France,Paris,Musée du Louvre,INV 19748,7096,"Lugt 1949, nr. 481; Paris/Hamburg 1985-86, p. 220, nr. 114","Paris/Hamburg 1985-86, under nr. 114",9761,,,http://arts-graphiques.louvre.fr/detail/oeuvres/1/109890-Route-dans-un-village-Cruybeke,503,brueghel_item,brueghel,img/derivatives/simple/3720/thumbnail.jpg,img/derivatives/simple/3720/full.jpg
3734,<table><tr><td>1700</td><td></td><td>First appears in the inventory of the Alcazar</td></tr></table>,<a href='/brughel/3433'><img src='/img/derivatives/simple/3433/thumbnail.jpg' /></a>,3433,Village Wedding Procession (Madrid),Painting,"Urban, Common and Peasant Life",Wedding Birds Chickens Dog Church Village Burghers Children Peasants Musical_instruments,ca. 1612,84,126,,,Panel,,,,,,,,,,,,,,Jan Brueghel the Elder,"Ertz 2008-10, #572, Ertz 1979, #363, Honig database",363,572,,,Public,Spain,Madrid,Museo del Prado,inv. #1441,6399,"Ertz 1979, cat. #363; Paris 1994, pp. 132-34; Ertz 2008-10, cat. #572, pp.1236-1243","Brussels 1980, cat. #137|Paris 1994, cat. #110|Santiago de Compostela 2011, cat. #23",3433,,,https://www.museodelprado.es/coleccion/obra-de-arte/boda-campestre/4dc0197d-9686-4967-a13b-89fd3465ab40,517,brueghel_item,brueghel,img/derivatives/simple/3734/thumbnail.jpg,img/derivatives/simple/3734/full.jpg
3052,<table><tr><td></td><td>France Paris</td><td>Musée Napoléon</td></tr></table>,,,Country Road with Figures and Animals,Drawing,Landscape,Cattle Horse Cart Road,,20.5,17.5,,,Paper,"Pen and brown ink, brown wash",,,,,,,,,,,,,Jan Brueghel the Elder,Bailey/Walker cat. #PARI.ML.8,,,PARI.ML.8,,Public,France,Paris,Musée du Louvre,INV 19747,7095,"Paris 1797, nr. 219; Paris 1820, nr. 426; Paris 1838, nr. 731; Lugt 1949, nr. 487",,,,,http://arts-graphiques.louvre.fr/detail/oeuvres/1/109889-Route-de-campagne-animee-de-figures-et-danimaux,144,brueghel_item,brueghel,img/derivatives/simple/3052/thumbnail.jpg,img/derivatives/simple/3052/full.jpg
10192,<table><tr><td>Jun 10 1999</td><td>Austria Vienna</td><td>Auction at Dorotheum Nr. 145</td></tr></table>,,,Seascape with Fortification,Painting,Staffage in Landscape,Dog Momper Harbor Boat,,46,62,,,Panel,,,,,,Joos de Momper (1564-1635),,,,,,,,Produced in Jan Brueghel's Studio,,,605,,,Private,,,,"Dorotheum, Vienna, Nr. 145, 10 June 1999",9751,"Ertz 1979, Abb. 1978; Ertz 1986, Kat. 12, Abb. 89",,,,,,077,brueghel_item,brueghel,img/derivatives/simple/10192/thumbnail.jpg,img/derivatives/simple/10192/full.jpg
3898,<table><tr><td>Jun 6 1808</td><td>Netherlands Rotterdam</td><td>Sale G. van der Pot van Groeneveld Lot #21</td></tr></table>,,,View of City along a River,Painting,"Village, Town and Cityscape",House Landing_stage River Burghers Fishermen Boat,ca. 1630,15.5,20.5,,,,,,,,,,,,,,,,,Produced in Jan Brueghel's Studio,"Rijksmuseum as attributed to Jan Brueghel the Elder, Ertz 1984, cat. #48 as Jan the Younger",,,,,Public,Netherlands,Amsterdam,Rijksmuseum,inv. #SK-A-66,6300,"Winner 1961, p. 215; Ertz 1979, p. 184, n. 195",Maastricht 2010|Amsterdam 2009-10,,,,http://hdl.handle.net/10934/RM0001.COLLECT.8077,590,brueghel_item,brueghel,img/derivatives/simple/3898/thumbnail.jpg,img/derivatives/simple/3898/full.jpg
3668,<table><tr><td>1753</td><td></td><td>Guarienti Inventory of 1753 inv. #518</td></tr></table>,<a href='/brughel/3513'><img src='/img/derivatives/simple/3513/thumbnail.jpg' /></a>,3513,Travelers on a Forested Road,Painting,Landscape,Traveling Horse Forest Road Wagon,1605-1610,42.5,66,,,Panel,,,,,,,,,,,,,,Jan Brueghel the Elder,"Ertz 2008-10, #19, Ertz 1979, #127, Honig database",127,19,,,Public,Germany,Dresden,"Staatliche Kunstsammlungen Dresden, Gemäldegalerie Alte Meister",inv. #890,6252,"Ertz 1979, cat. #127, fig. 293; Ertz 2008-10, cat. #19",,3513,,,,462,brueghel_item,brueghel,img/derivatives/simple/3668/thumbnail.jpg,img/derivatives/simple/3668/full.jpg
3683,<table><tr><td>Before 1764</td><td>Germany Berlin</td><td>Gotzkowsky Collection</td></tr><tr><td>1764</td><td>Russia St. Petersburg</td><td>Purchased by the Hermitage</td></tr><tr><td></td><td></td><td>Sale</td></tr><tr><td>1915</td><td>Russia St. Petersburg</td><td>Acquired by the Hermitage from the Semjenov-Tjanschanski Collection</td></tr></table>,,,Venus and Amor (St. Petersburg),Painting,Classical Mythology,Guinea_Pigs Van_Balen Nude Putti Classical History Mythological Flowers Fruit,1608,190,148,,,Canvas,,H.V. BALEN 1608,,,,Hendrick van Balen (1575-1632),,,,,,,,Jan Brueghel the Elder,"Ertz 2008-10, #392, Honig database",,392,,,Public,Russia,St. Petersburg,The Hermitage,inv. #3256,6278|6279|6280|6281,"Werche 2004, cat. #A 114; Ertz 2008-10, cat. #392",,,,,,477,brueghel_item,brueghel,img/derivatives/simple/3683/thumbnail.jpg,img/derivatives/simple/3683/full.jpg
3867,<table><tr><td></td><td>Denmark Copenhagen</td><td>Collectio nof G. Moltke</td></tr><tr><td></td><td></td><td>Collection of G. Sadolin Dragor</td></tr><tr><td>Spring 1965</td><td>England London</td><td>Gallery of L. Koetser Lot #13</td></tr><tr><td>After 1965</td><td>Switzerland Geneva</td><td>Gallery of David H. Koetser</td></tr><tr><td>1979</td><td>Switzerland</td><td>Private Collection</td></tr><tr><td>1999</td><td>Switzerland Zürich</td><td>Gallery of David H. Koetser inv. #15</td></tr></table>,,,Village Fish Market with Scipio&apos;s Grave,Painting,"Village, Town and Cityscape",Fish Horse Ruins Coast Landing_stage Fishermen Merchants Boat,ca. 1609,21.6,31.8,,,Copper,,BRUEGHEL 160(9),,,,,,,,,,,,Jan Brueghel the Elder,"Ertz 2008-10, #103, Ertz 1979, #125, Honig database",125,103,,,Private,,,,Private Collection,6332|6333|6334|6335|6336|6337,"Ertz 1979, cat. #125",,,,,,583,brueghel_item,brueghel,img/derivatives/simple/3867/thumbnail.jpg,img/derivatives/simple/3867/full.jpg
3442,<table><tr><td>1794</td><td></td><td>Gustav Adolf Spparre S. 118 inv. #49</td></tr><tr><td>1895</td><td>Sweden</td><td>Collection of Sergeant</td></tr></table>,,,Preaching of John the Baptist (London),Painting,Religious,Preaching Van_Balen Forest Burghers Children Soldiers New_Testament Saint,1605-1608,46,66.6,,,Copper,,,,,,Hendrick van Balen (1575-1632),,,,,,,,Produced in Jan Brueghel's Studio,"Ertz 2008-10, #258, Honig database as uncertain, possibly studio",,258,,,Private,,,,"London, Sotheby's, December 5, 2007, #1",5764|5765,"Ertz 2008-10, cat. #258",,,,,,312,brueghel_item,brueghel,img/derivatives/simple/3442/thumbnail.jpg,img/derivatives/simple/3442/full.jpg
9635,,,,Landscape near Ferrara,Drawing,Landscape,,,14.5,21.1,,,Paper,"Pen, sepia, color keys",,,,,,,,,,,,,,Bailey/Walker cat. #BRUS.MR.8,,,BRUS.MR.8,,Public,Belgium,Brussels,Musées Royaux des Beaux-Arts de Belgique,476,,"Grez 1913, nr. 476",,,,,,620,brueghel_item,brueghel,img/derivatives/simple/9635/thumbnail.jpg,img/derivatives/simple/9635/full.jpg
2953,<table><tr><td>1885</td><td>Poland Warsaw</td><td>Acquired from W. Kolansinski</td></tr></table>,<a href='/brughel/3207'><img src='/img/derivatives/simple/3207/thumbnail.jpg' /></a>|<a href='/brughel/3200'><img src='/img/derivatives/simple/3200/thumbnail.jpg' /></a>|<a href='/brughel/3288'><img src='/img/derivatives/simple/3288/thumbnail.jpg' /></a>|<a href='/brughel/3202'><img src='/img/derivatives/simple/3202/thumbnail.jpg' /></a>|<a href='/brughel/3203'><img src='/img/derivatives/simple/3203/thumbnail.jpg' /></a>|<a href='/brughel/3004'><img src='/img/derivatives/simple/3004/thumbnail.jpg' /></a>|<a href='/brughel/3213'><img src='/img/derivatives/simple/3213/thumbnail.jpg' /></a>|<a href='/brughel/3229'><img src='/img/derivatives/simple/3229/thumbnail.jpg' /></a>|<a href='/brughel/3212'><img src='/img/derivatives/simple/3212/thumbnail.jpg' /></a>|<a href='/brughel/3205'><img src='/img/derivatives/simple/3205/thumbnail.jpg' /></a>,3207|3200|3288|3202|3203|3004|3213|3229|3212|3205,Attack on Traveler in the Woods,Painting,Landscape,Hunting Robbery Birds Vrancx Forest Stream,ca. 1605,41,65.5,,,Panel,,,,,,Sebastiaen Vrancx (1573-1647),,,,,,,,Jan Brueghel the Elder,"Ertz 2008-10, #95, Ertz 1979, #134, Honig database",134,95,,,Public,Poland,Warsaw,Muzeum Narodowe,"inv. #622, 1885",4660,"Ertz 1979, cat. #134, fig. 249; Essen/Vienna 1997, cat. #46, p. 190; Ertz 2008-10, cat. #95; Wood Ruby 2012, p. 280, fig. 20","Dresden 1972, #17|Essen/Vienna 1997, cat. #46",3207|3200|3288|3202|3203|3004|3213|3229|3212|3205,,,,443,brueghel_item,brueghel,img/derivatives/simple/2953/thumbnail.jpg,img/derivatives/simple/2953/full.jpg
3495,<table><tr><td></td><td>England Herefordshire</td><td>Hopton Collection Canon Frome Court</td></tr><tr><td>Jul 15 1953</td><td>England London</td><td>Sale Sotheby's Lot #7</td></tr><tr><td>Dec 10 1975</td><td>England London</td><td>Sale Sotheby's Lot #63</td></tr><tr><td>1976</td><td>England London</td><td>Richard Green Gallery</td></tr><tr><td>Before 1979</td><td></td><td>Collection of Isidore Ostrer</td></tr></table>,<a href='/brughel/3492'><img src='/img/derivatives/simple/3492/thumbnail.jpg' /></a>|<a href='/brughel/3845'><img src='/img/derivatives/simple/3845/thumbnail.jpg' /></a>|<a href='/brughel/3485'><img src='/img/derivatives/simple/3485/thumbnail.jpg' /></a>,3492|3845|3485,River with Landing Stage by Village: Sorting Catch of Fish,Painting,"Village, Town and Cityscape",Birds Fish Horse Church House Landing_stage River Fishermen Merchants Boat Wagon,ca. 1606,30.5,40,,,Copper,,,,,,,,,,,,,,Produced in Jan Brueghel's Studio,"Ertz 2008-10, #122, Ertz 1979, #142, Honig database as Jan and studio",142,122,,,Private,,,,"Germany, Private Collection",5863|5864|5865|5866|5867,"Ertz 1979, cat. #142, no figure number; Ertz 2008-10, cat. #122",,3492|3845|3485,,,,356,brueghel_item,brueghel,img/derivatives/simple/3495/thumbnail.jpg,img/derivatives/simple/3495/full.jpg
2947,<table><tr><td>1753</td><td>England London</td><td>Bequeathed by Sir Hans Sloane</td></tr></table>,<a href='/brughel/3594'><img src='/img/derivatives/simple/3594/thumbnail.jpg' /></a>,3594,Ancient Ruins at Baiae,Drawing,Ruins,Cattle Ruins Temple,ca. 1604,14,26.4,,,Paper,"Pen and brown ink with gray-brown and blue wash, with lines indented",,,,,,,,,,,,,Jan Brueghel the Elder,Bailey/Walker cat. #LOND.BM.23,,,LOND.BM.23,,Public,England,London,British Museum,"RN SL,5236.52",6845,"Hind 1915, nr. 5; Winner 1972, p. 136-7, fig. 18",,3594,,,http://www.britishmuseum.org/research/collection_online/collection_object_details.aspx?objectId=712255&partId=1&searchText=SL%2C5236.52&view=list&page=1,403,brueghel_item,brueghel,img/derivatives/simple/2947/thumbnail.jpg,img/derivatives/simple/2947/full.jpg
3481,,<a href='/brughel/3478'><img src='/img/derivatives/simple/3478/thumbnail.jpg' /></a>,3478,River Landscape with Landing Stage (Turin),Painting,"Village, Town and Cityscape",Birds Church House River Burghers Fishermen Boat,1603-1608,19,24,,,Copper,,BRUEGHEL 160(3?),,,,,,,,,,,,Produced in Jan Brueghel's Studio,"Ertz 2008-10, #110, Ertz 1979, #95, Honig database as uncertain, possibly studio",95,110,,,Public,Italy,Turin,Galleria Sabauda,inv. #215,,"Ertz 1979, cat . #95, fig. 211; Ertz 2008-10, cat. #110",,3478,,,,344,brueghel_item,brueghel,img/derivatives/simple/3481/thumbnail.jpg,img/derivatives/simple/3481/full.jpg
3480,,,,River Landscape with Landing Stage (London),Painting,"Village, Town and Cityscape",Roundel Landing_stage River Peasants Boat,1612,,,21.5,,Copper,,BRUEGHEL 1612,,,,,,,,,,,,Jan Brueghel the Elder,"Ertz 2008-10, #129, Ertz 1979, #258, Honig database",258,129,,,Private,,,,"London, Christie's, July 7, 1978, #173",,"Ertz 1979, cat. #258, fig. 214; Ertz 2008-10, cat. #129, p. 282",,,,,,343,brueghel_item,brueghel,img/derivatives/simple/3480/thumbnail.jpg,img/derivatives/simple/3480/full.jpg
